sentence,fuel,machine,others,part,price,service
Saya memakai Honda Jazz GK5 tahun 2014 ( pertama meluncur ) . Mobil nya bagus dan enak sesuai moto nya menyenangkan untuk dikendarai,neutral,neutral,positive,neutral,neutral,neutral
Avanza kenapa jadi boros bensin begini dah ah. Baru diisi sudah mau setengah saja .,negative,neutral,neutral,neutral,neutral,neutral
"saran ku dan pengalaman ku , mending beli mobil niaga L300 atau canter . irit dan bandel .",positive,positive,neutral,neutral,neutral,neutral
Dari segi harga juga pajero lebih mahal 30 jutaan dibanding fortuner,neutral,neutral,neutral,neutral,positive,neutral
Kalo menurut gw enak pajero si,neutral,neutral,positive,neutral,neutral,neutral
CH - R versi negara ini kurang worth it soal fitur dan kelengkapan,neutral,neutral,neutral,negative,neutral,neutral
"@LinaRadj kapan-kapan coba bengkel daihatsu , mereka mau kok . Servis lebih bagus .",neutral,neutral,neutral,neutral,neutral,positive
Mending confero harga nya lebih murah daripada formo.,neutral,neutral,neutral,neutral,negative,neutral
kalo soal servis mending pilih grand livina soalnya after sales service nya mudah dan cepat,neutral,neutral,neutral,neutral,neutral,positive
Lampu utama depan Grand New Veloz juga mendapatkan perubahan desain dan terkesan lebih agresif dan sedikit menonjol,neutral,neutral,neutral,positive,neutral,neutral
Motor beat aku yang menemani aku di saat ke mana saja dan yang penting bbm - nya ramah lingkungan dan ramah juga di kantong dan tarikan nya mantap banget .,positive,positive,neutral,neutral,neutral,neutral
"Xenia tahun 2008 bolak-balik jakarta - bandung , aki tetap aman .",neutral,neutral,neutral,positive,neutral,neutral
#YamahaID Perawatan Motor Injeksi Yamaha Mudah dan Murah,neutral,neutral,neutral,neutral,neutral,positive
Buat dalam kota xpander bagus karna model nya kalem dan kesan nya car city,neutral,neutral,neutral,positive,neutral,neutral
brio pajak nya murah karena ckd daripada ignis atau sirion yg cbu pajak nya agak mahal trus onderdil nya agak susah atau lama kalo mau klaim asuransi,neutral,neutral,neutral,negative,negative,neutral
toyota menang harga nya kalo nantinya mau dijual,neutral,neutral,neutral,neutral,positive,neutral
All New Toyota Kijang Innova G Diesel 2017 . Mesin bandel nan irit Otolovers .,positive,positive,neutral,neutral,neutral,neutral
"Khusus nya Daihatsu Xenia Sporty Manual , apalagi yang terbaru ini , di samping irit bbm , suara mesin halus . Tarikan lebih baik dari generasi sebelumnya dan akselerasi cukup baik dan variasi tidak terlalu monoton atau ramai .",positive,positive,neutral,positive,neutral,neutral
untuk yang sekarang great new xenia sudah mempunyai fasilitas yang wow dengan harga yang bersahabat bahkan lebih murah daripada rival nya,neutral,neutral,neutral,positive,positive,neutral
"punya mobil altis tidak awet , baru setahun sudah rusak .",neutral,neutral,negative,neutral,neutral,neutral
Xenia ku tipe xi sudah 1.5 tahun dan cukup bangga dengan performa nya,neutral,positive,neutral,neutral,neutral,neutral
"Service rutin ke bengkel daihatsu resmi gak jaminan juga , rem - ku blong waktu jalan ,",neutral,neutral,neutral,neutral,neutral,negative
"Saya pakai karimun , adik saya pakai brio . memang karimun lebih nyaman walau lebih murah dari brio .",neutral,neutral,positive,neutral,positive,neutral
bodi plus tampilan nya Avanza baru mantap juragan,neutral,neutral,neutral,positive,neutral,neutral
Sudah dari dulu Toyota selalu kasih produk super mahal dengan fitur pas pasan,neutral,neutral,neutral,negative,negative,neutral
"udah gaya nya stylish ekonomis pula, beli calya deh",neutral,neutral,neutral,positive,positive,neutral
avanza ini mobil saya yang paling bandel,neutral,positive,neutral,neutral,neutral,neutral
Mobil kualitas jelek kayak wuling saja masuk Indonesia.,neutral,neutral,negative,neutral,neutral,neutral
Pelayanan bengkel daihatsu bagus,neutral,neutral,neutral,neutral,neutral,positive
"gue punya xenia xi , dasbor nabrak pohon , setelah dua hari diperbaiki di servis resmi daihatsu , langsung jadi kayak baru lagi , keren .",neutral,neutral,neutral,neutral,neutral,positive
"fortuner per nya keras , capek",neutral,neutral,neutral,negative,neutral,neutral
"Lebih bagus Mobil Esemka , Mobil Nasional Asli Buatan Dalam Negeri , Harga Terjangkau , Irit BBM Mesin nya juga tangguh .",positive,positive,positive,neutral,positive,neutral
"ya begitu itu Nissan , memang agak mahal tetapi daya tahan nya bagus .",neutral,neutral,positive,neutral,negative,neutral
fortuner gak cocok buat mahasiswa dari segi desain yang terlalu mencolok dan mahal pula,neutral,neutral,neutral,negative,neutral,neutral
Servis di Bengkel Toyota Lebih cepat,neutral,neutral,neutral,neutral,neutral,positive
Honda Spacy irit banget sumpah,positive,neutral,neutral,neutral,neutral,neutral
Gak bisa tidur kalau malam-malam di mobil karena suara ac nya berisik sekali,neutral,neutral,neutral,negative,neutral,neutral
"Ih bengkel honda ini picik banget ya , masa iya aki motor gue ditukar sama yang jelek biar gak bisa hidup terus ada keluhan terus ke sana lagi gitu",neutral,neutral,neutral,neutral,neutral,negative
"dari segi kenyamanan cortez oke lah, tapi bahan bakar nya itu loh boros banget",negative,neutral,positive,neutral,neutral,neutral
"jujur saja inden nya lama banget dari dealer , sudah 1 bulan belum datang juga",neutral,neutral,neutral,neutral,neutral,negative
numpang gabung ya baru beli xenia 04 - 2008 3 hari yang lalu keseluruhan gue ngerasa cukup .,neutral,neutral,positive,neutral,neutral,neutral
setuju banget kalau jazz lebih keren dan mantap daripada mobilio,neutral,neutral,negative,neutral,neutral,neutral
"Masya Allah toyota mahal harga nya , tetapi pelit fitur-fitur",neutral,neutral,neutral,negative,negative,neutral
fortuner sparepart nya banyak dijual di mana-mana,neutral,neutral,neutral,positive,neutral,neutral
"Alhamdullilah inden dari dealer wulling agustus awal mobil sudah datang , cepat .",neutral,neutral,neutral,neutral,neutral,positive
"Vario 125 sangat ringan dan nyaman dipakai untuk perempuan seperti saya , apalagi dibawa ke mana-mana sangat irit dan harga nya terjangkau dibandingkan motor honda yang lain .",positive,neutral,positive,neutral,positive,neutral
"Udah beli yg rush 2018 , alhamdulillah tidak ada penyesalan sampai saat ini dan insyaAllah seterusnya",neutral,neutral,positive,neutral,neutral,neutral
handling mini cooper juara .,neutral,neutral,neutral,positive,neutral,neutral
Saya sangat puas dengan mobil saya selain berbadan besar terlihat mewah dan sangat irit bahan bakar karena minum nya solar jadi mantap kijang innova,positive,neutral,positive,positive,neutral,neutral
xenia gak awet banget masa baru 6 bulan sudah bermasalah,neutral,neutral,negative,neutral,neutral,neutral
lama banget nunggu inden xpander keburu saya jual ini mobil,neutral,neutral,neutral,neutral,neutral,negative
"Saya naik mazda CX3 sehari-hari . performa mantap , mobil nyaman tidak seperti honda hrv yang cenderung goyang-goyang",neutral,neutral,negative,neutral,neutral,neutral
"Avanza guncangan mesin nya halus meski di jalan yang tak mulus , AC enggak menurun meski dinyalakan tanpa henti , dan mesin enggak cepat panas berlebih meski macet bermenit-menit .",neutral,positive,neutral,positive,neutral,neutral
"Wuling Formo mobil cina, mesin nya enggak berumur panjang karena di cina juga enggak ada yang umur nya panjang.",neutral,negative,neutral,neutral,neutral,neutral
"Mobil honda emang keren , saya punya honda CRV tahun 2006 sampai sekarang masih mulus ,",neutral,neutral,positive,neutral,neutral,neutral
"Honda slalu nanggung dan maksa tiap kali melakukan upgrade mobil yangg sudah ada , membosankan",neutral,neutral,negative,neutral,neutral,neutral
Bengkel ahas togosari service nya tidak memuaskan mekanik nya gak fokus dan jelek . tidak seperti dulu . gimana itu bos .,neutral,neutral,neutral,neutral,neutral,negative
"Buat yang orientasi pengendara , Mitsubishi ini cocok banget mau mobil yang menyenangkan untuk dikendarai enak dibawa luar sama dalam kota",neutral,neutral,positive,neutral,neutral,neutral
N - Max biaya perawatan mahal bakal lebih boros dari pada kamu naik angkutan umum,neutral,neutral,neutral,neutral,neutral,negative
Fortuner lebih mewah lebih besar,neutral,neutral,positive,neutral,neutral,neutral
"@DaihatsuInd Xenia itu kita banget ! Cocok diajak ke mana-mana , service gampang , harga terjangkau , mudah dipakai .",neutral,neutral,positive,neutral,positive,positive
Kenapa saya pilih pajero karena saya sering pulang kampung waktu lebaran dan jalan nya kebanyakan jelek dan tanjakan nya full curam belom di aspal,neutral,positive,neutral,neutral,neutral,neutral
"Konsumsi bbm bisa dipaksa 1:12 kalau bawa nya waras , lumayan irit si Altis G 2003 MT ini",positive,neutral,neutral,neutral,neutral,neutral
"harga purnajual memang Toyota lebih baik . tetapi ya orang macam gua mikir nya beli mobil ya buat dipakai , bukan dijual . Hehe",neutral,neutral,neutral,neutral,positive,neutral
"@YamahaIndonesia pelayanan bengkel yamaha di poso jelek sekali bung , hari kemarin bilang nyuruh hari ini , hari ini datang bilang tidak bisa",neutral,neutral,neutral,neutral,neutral,negative
"Saya membeli Honda Beat ini pada tahun 2015 , sudah tiga tahun lama nya umur motor ini . Saya bekerja dengan jarak tempuh lumayan jauh dari rumah saya , tetapi terbukti hingga saat ini sangat irit bbm - nya , di lain sisi ada dobel rem yang membuat sepeda ini menjadi luar biasa .",positive,neutral,neutral,positive,neutral,neutral
Head Lamp Avanza juga menggunakan model terbaru . Dengan perubahan tersebut mobil ini memiliki desain yang lebih elegan juragan .,neutral,neutral,neutral,positive,neutral,neutral
"saya menyesal beli mobilio, tetangga beli wuling cortez puas banget",neutral,neutral,positive,neutral,neutral,neutral
brio adalah salah satu mobil ekonomis untuk keluarga menengah,neutral,neutral,neutral,neutral,positive,neutral
"kaki-kaki juga aman normal jaya . belum pernah ganti sparepart apa pun kecuali oli radiator dan filter , mantap brio",neutral,neutral,neutral,positive,neutral,neutral
"Ada satu lagi nih yang menurut saya sepele tetapi jadi kenikmatan , yaitu fitur Brake Hold di HRV",neutral,neutral,neutral,positive,neutral,neutral
xpander terlihat seperti mobil tahun 2020,neutral,neutral,positive,neutral,neutral,neutral
Toyota rush terbaik di kelas nya dan terdepan di zaman nya .,neutral,neutral,positive,neutral,neutral,neutral
brio gak bagus sumpah .,neutral,neutral,negative,neutral,neutral,neutral
"Dipakai kerja tiap hari enggak pernah rewel , mesin bandel , sesuai dengan kebutuhan , BBM irit tiada banding .",positive,positive,positive,neutral,neutral,neutral
mendingan Mitsubishi Xpander yang rata rata menang disegala aspek,neutral,neutral,positive,neutral,neutral,neutral
Kok bengkel toyota payah banget sih . Kata nya bakal dipanggil nomor nya tapi nomor nya manual :(,neutral,neutral,neutral,neutral,neutral,negative
cukup 10 menit untuk bersihkan injektor motor injeksi Yamaha :D arti nya motor injeksi YMH perawatan murah & mudah,neutral,neutral,neutral,neutral,neutral,positive
"Kekurangan dari Formo sekilas: minim fitur safety, kualitas finishing interior jelek.",neutral,neutral,neutral,negative,neutral,neutral
Susah banget telepon buat booking servis auto 2000 toyota ! Masa gue harus booking ke sana sih :(,neutral,neutral,neutral,neutral,neutral,negative
Yamaha motor injeksi nya lebih mudah dan murah perawatan nya,neutral,neutral,neutral,neutral,neutral,positive
"Pengalaman pakai HRV 1.5 E , berisik shockbreaker pas di tol cikampek dan terbanting-banting kalau duduk di belakang",neutral,neutral,neutral,negative,neutral,neutral
"Honda Beat bahan bakar sangat irit , ringan buat menyalip di jalanan macet , mesin tarikan enteng banget .",positive,positive,positive,neutral,neutral,neutral
Mobil WULING CONFERO sangat layak untuk dipilih dan DIBELI sebagai mobil MPV yang nyaman dengan harga terjangkau .,neutral,neutral,neutral,neutral,positive,neutral
Memilih Terios baru rasanya tidak keliru,neutral,neutral,positive,neutral,neutral,neutral
"Xenia irit banget apalagi kalau lagi kere . coba matikan saja ac - nya , bisa jalan-jalan dengan 25.000 rupiah .",positive,neutral,neutral,neutral,neutral,neutral
Mobil wuling confero S nyaman dipakai di medan petualangan .,neutral,neutral,positive,neutral,neutral,neutral
Puas banget sama after sales-nya Nissan.,neutral,neutral,neutral,neutral,neutral,positive
"Avanza mudah dalam perawatan ,",neutral,neutral,neutral,neutral,neutral,positive
"kalau soal mesin dan bentuk toplah yamaha , kayak sekarang saya pakai nmax 2018 yang memang sudah lama saya incar , dari bentuk saya suka sekali .",neutral,positive,neutral,positive,neutral,neutral
"masalah nya , Xenia 2005 kadang-kadang dasbor bunyi ,",neutral,neutral,neutral,negative,neutral,neutral
"Dan cabin nya juga lebih luas fortuner , kalau pajero sempit apalagi di bagian depan",neutral,neutral,neutral,negative,neutral,neutral
"Service bengkel pinggir jalan dibilang jelek hasil service di dealer resmi pelayanan jelek , scumbag honda",neutral,neutral,neutral,neutral,neutral,negative
selama ini pakai xexi lumayan enak dan nyaman juga .,neutral,neutral,positive,neutral,neutral,neutral
"rata-rata bbm - nya luar kota juga bisa sampai 1:16 , irit banget mitsubishi",positive,neutral,neutral,neutral,neutral,neutral
"1 kelemahan xenia , DUDUK DI BARIS PALING BELAKANG KAYAK NAIK UNTA ! GILA BERASA BANGET PUYENGNYA .",neutral,neutral,neutral,negative,neutral,neutral
Tapi yang sangat jelek dari Freed adalah tarikan nya .,neutral,negative,neutral,neutral,neutral,neutral
Fortuner Itu Mobil Tenaga nya Lemah Harga Selangit,neutral,negative,neutral,neutral,negative,neutral
saya saranin beli vario aja suku cadang meadai purnajual juga oke,neutral,neutral,neutral,positive,positive,neutral
"brio gak cocok dibawa pergi ke medan yang susah, lemah dia",neutral,neutral,positive,neutral,neutral,neutral
"Simpel cocok dijuluki untuk nya Honda beat makin bertambah gaya desain minimalis namun juara di kelas nya , bahan bakar juara nya hemat ramah dan bersahabat dengan saku maupun di dompet , sukses selalu Honda one Heart",positive,neutral,neutral,positive,positive,neutral
"Soal tenaga yang kurang di ertiga juga agak mengganggu ,",neutral,negative,neutral,neutral,neutral,neutral
"New Veloz saya rasa udah banyak improvement nya , terutama di bagian suspensi nya dibanding sebelumnya . Mental mentul , body roll , limbung sudah berkurang .",neutral,neutral,neutral,positive,neutral,neutral
@DaihatsuInd banyak yang mengeluh servis ke 2 di astra daihatsu mahal . tolong edukasikan ke bengkel-bengkel resmi jangan mainin harga atau sparepart yang bagus gak perlu diganti,neutral,neutral,neutral,neutral,neutral,negative
terus radio nya HRV nyala sendiri dengan volume maksimal . enggak bisa dimatikan dan dikecilkan .,neutral,neutral,neutral,negative,neutral,neutral
"wah AVS kamu irit banget kak , AVG saya saja sekitar 1:8 sampai 1:9 memang macet sih jalanan .",positive,neutral,neutral,neutral,neutral,neutral
"Fortuner adalah mobil impian saya . Ini adalah suv mahal memang , tetapi sepadan .",neutral,neutral,neutral,neutral,negative,neutral
"kalau melihat spesifikasi nya, harga ertiga cukup ramah di kantong",neutral,neutral,neutral,neutral,positive,neutral
Ternyata perawatan yamaha rata rata lebih murah dari kompetitor .,neutral,neutral,neutral,neutral,neutral,positive
"Sudah dua tahun saya memiliki motor Honda Beat ini , motor ini keseharian nya saya pergunakan untuk antar anak sekolah dan bekerja . Motor yang lumayan gesit , lincah dan irit BBM .",positive,positive,neutral,neutral,neutral,neutral
Pajero mempunyai mesin yang lebih bertenaga dan banyak fitur,neutral,positive,neutral,positive,neutral,neutral
suzuki ignis dan Daihatsu sirion harga jual nya juga enggak stabil,neutral,neutral,neutral,neutral,negative,neutral
kalau menurut gue suspensi avanza agak aneh . kalau cuma berdua suspensi nya berasa keras banget . tetapi kalau diisi penuh 6 - 7 orang suspensi nya mantap betul .,neutral,neutral,neutral,negative,neutral,neutral
"kalau sudah di atas 120 km / jam boros banget avanza saya , terus kopling nya memang agak keras juragan .",negative,neutral,neutral,negative,neutral,neutral
"Pertama kali memiliki mobil ini rasanya seperti mimpi , karena setelah dapat mobil ternyata menang undian juga 10 juta rupiah dari Daihatsu . Mobil irit , servis mudah dan murah .",positive,neutral,neutral,neutral,neutral,positive
mendingan vrz 4*4 sekalian fitur lengkap spoiler bisa beli di toko variasi,neutral,neutral,neutral,positive,neutral,neutral
Rush konde konsumsi BBM yang tetap irit .,negative,neutral,neutral,neutral,neutral,neutral
Xenia memang masih kurang dari segi keamanan nya . Air bag - nya kagak ada bos .,neutral,neutral,neutral,positive,neutral,neutral
Pajero sport Dakar memang di atas Fortuner,neutral,neutral,negative,neutral,neutral,neutral
Dulu gue enggak suka sama xpander .,neutral,neutral,negative,neutral,neutral,neutral
Altis gen 11 pas lah buat yang cari kenyamanan berkendara,neutral,neutral,positive,neutral,neutral,neutral
"Fortuner saya kok setir nya agak enggak enak gitu , ya . Enggak luwes .",neutral,neutral,neutral,negative,neutral,neutral
Putaran bawah mesin fortuner sangat kuat,neutral,positive,neutral,neutral,neutral,neutral
jujur fortuner ini bandel banget dipakai di medan apa pun,neutral,positive,neutral,neutral,neutral,neutral
pengalaman saya punya avanza bahan bakar nya lebih hemat daripada ketika saya punya xenia,negative,neutral,neutral,neutral,neutral,neutral
"kemarin saya di honda brio , baru 2 tahun pakai dan jarang dipakai kaki-kaki sudah bunyi , rem cepat habis , sama sil booster rem atau master rem yang rembes",neutral,neutral,neutral,negative,neutral,neutral
"Sirion ini terlalu overpriced bos , bisa ngga laku di indonesia",neutral,neutral,negative,neutral,negative,neutral
xenia ini mobil paling jelek yang pernah saya punya,neutral,neutral,negative,neutral,neutral,neutral
saya akui enak banget Hrv ini mengendarai punya saudara pakai Hrv,neutral,neutral,positive,neutral,neutral,neutral
Payah payah gak ada yang becus nih bengkel honda . seminggu dari bengkel sudah bunyi lagi saja .,neutral,neutral,neutral,neutral,neutral,negative
"DAIHATSU TARUNA , Selain tampang nya modern kala itu , kapasitas penumpang nya banyak dan tentu saja , mobil ini sudah dibuat ala-ala SUV",neutral,neutral,neutral,positive,neutral,neutral
menurut saya dari segi kenyamanan sih bolehlah lumayan si xenia,neutral,neutral,positive,neutral,neutral,neutral
Avanza bahan bakar nya yang irit .,positive,neutral,neutral,neutral,neutral,neutral
Toyota rush 2018 tarikan nya luar biasa,neutral,positive,neutral,neutral,neutral,neutral
Avanza mobil yang nyaman untuk keluarga dan tidak terlalu mahal perawatan nya,neutral,neutral,positive,neutral,neutral,positive
"saya baca di atas tetangga , xenia juga naik itu sekitar 2 - 3 juta . makin mahal saja ya mobil sekarang .",neutral,neutral,neutral,neutral,negative,neutral
Makanya kapok untuk datang ke bengkel Honda Autoland kalau untuk servis serius karena pasti akan dibantah,neutral,neutral,neutral,neutral,neutral,negative
Selalu setia menggunakan setiap produk nissan .,neutral,neutral,positive,neutral,neutral,neutral
"entah kenapa si avsen kalau untuk mobil perang jauh lebih oke , walau enggak stabil , enggak terlalu nyaman ,",neutral,neutral,negative,neutral,neutral,neutral
"suka sekali sama agya, tarikan nya itu loh halus banget",neutral,positive,neutral,neutral,neutral,neutral
"Gua terang pilih pajero , selain keren model nya dan kelihatan dinamis , mesin juga mantap , model dasboard sporty",neutral,positive,positive,positive,neutral,neutral
"Toyota Rush saya sudah berusia 8 , tenaga nya kurang power full",neutral,negative,neutral,neutral,neutral,neutral
"Sudah seminggu punya lexi , jauh lebih nyaman dibandingkan vario .",neutral,neutral,negative,neutral,neutral,neutral
Tarikan lincah pasti Avanza,neutral,positive,neutral,neutral,neutral,neutral
xenia lari nya lebih lincah daripada avanza yang agak lemah,neutral,negative,neutral,neutral,neutral,neutral
tenaga maknyus bagus . Vario125 esp combi brake enak enggak memalukan .,neutral,positive,neutral,positive,neutral,neutral
avanza saya kopling nya memang agak keras juragan .,neutral,neutral,neutral,negative,neutral,neutral
tetapi harga otr xi lebih mahal daripada li,neutral,neutral,neutral,neutral,positive,neutral
Mitshubisi raja jalanan,neutral,neutral,positive,neutral,neutral,neutral
"Ambil mobil di Bengkel Honda Pondok Indah . sudah selesai servis , tapi mobil kotor banget . tapi teknisi ngotot sudah dicuci .",neutral,neutral,neutral,neutral,neutral,negative
gue pengguna xenia li vvti 2008 selama memakai tidak ada masalah lancar-lancar,neutral,neutral,positive,neutral,neutral,neutral
"memang xenia bandel , gue senang banget sama mobil gue ini .",neutral,positive,positive,neutral,neutral,neutral
yang jelas gue enggak menyesal pilih calya,neutral,neutral,positive,neutral,neutral,neutral
Kalo gue sih yang pemula . Lebih suka exterior brio . Cuma kalo kelengkapan fitur memang sirion,neutral,neutral,neutral,positive,neutral,neutral
Buat yang punya Avanza dan Xenia pasti sudah merasakan berisik nya suara di dalam kabin dan lemah nya bantingan mobil .,neutral,neutral,neutral,negative,neutral,neutral
avanza oke banget manuver nya,neutral,positive,neutral,neutral,neutral,neutral
"Avanza memiliki kapasitas 7 penumpang yang nyaman dan aman , dan daya tahan lebih baik berkat sasis semi - monokok yang digabung dengan sub-frame juragan",neutral,neutral,neutral,positive,neutral,neutral
"sudah harga nya mahal, fortuner ini juga konsumsi bahan bakar nya lumayan menguras dompet",negative,neutral,negative,neutral,neutral,neutral
xenia li cukup mumpuni kok sebagai mobil irit dan cukup bertenaga .,positive,positive,neutral,neutral,neutral,neutral
fortuner sparepart nya susah dicari,neutral,neutral,neutral,negative,neutral,neutral
"yang saya suka dari avanza itu volume nya yang besar, anak-anak bisa bebas bersantai di dalam mobil",neutral,neutral,neutral,positive,neutral,neutral
"saya punya xenia Li 08 family , sepanjang pemakaian nya belum ada keluhan sih .",neutral,neutral,positive,neutral,neutral,neutral
"Langsung kagum bgt dengan kenyamanan nya , mulai dari kedap nya kabin , bantingan suspensi dll",neutral,neutral,positive,positive,neutral,neutral
"fortuner gimana yah ... tenaga biasa aja , kalo pajero sport tenaga gak malu - maluin",neutral,positive,neutral,neutral,neutral,neutral
"12 cup holders kok kesan nya ga berfaedah buat mobil seven seater , nama nya aja seven seater ngapain sampe 12 wikwikwik , mendingan legain kabin drpd banyakin cup holder",neutral,neutral,neutral,negative,neutral,neutral
Honda Brio punya setir yang presisi dan tegak seperti 86 begitu pun jok sporty - nya ala racing .,neutral,neutral,neutral,positive,neutral,neutral
"menyesal beli agya, tarikan lambat kalau dipakai rame-rame gak kuat",neutral,negative,neutral,neutral,neutral,neutral
Kalo soal overall si jelas banget pajero lebih menang ketimbang fortuner,neutral,neutral,negative,neutral,neutral,neutral
alasan nya harga fortuner di bawah harga pajero,neutral,neutral,neutral,neutral,negative,neutral
Salah satu yang paling saya suka dari merek Honda ini adalah ultra seat,neutral,neutral,neutral,positive,neutral,neutral
semakin cantik saja nih avanza juragan,neutral,neutral,positive,neutral,neutral,neutral
"Mobil ini gue akui paling pas untuk kerja dengan mobilitas tinggi , gede nggak , kecil juga nggak , masuk2 kampung gang kecil tanjakan terjal lincah , dan yg paling penting penggerak roda belakang cocok buat segala medan",neutral,positive,neutral,positive,neutral,neutral
"Ignis Worth it mas dengan harga terendah 139,5 juta .",neutral,neutral,neutral,neutral,positive,neutral
"Beli beat fi buat harian , Tarikan nya nyaman , irit banget kalau dibuat kuliah . Harga oke .",positive,positive,neutral,neutral,positive,neutral
Wuling confero S 1.5 L Lux+ ke jawa timur park 3 terasa kenyamanan mobil ini tidak limbung .,neutral,neutral,positive,neutral,neutral,neutral
"keren juga xpander , serasa mobil masa depan",neutral,neutral,positive,neutral,neutral,neutral
"konsumsi bbm HRV juga irit banget bisa sampe 13,5 km / l",positive,neutral,neutral,neutral,neutral,neutral
kelebihan Avanza yang membuat saya jatuh hati sama avanza adalah penggunaan sistem penggerak roda belakang atau rear wheel drive .,neutral,neutral,neutral,positive,neutral,neutral
Hadeh toyota prado segala rusak . Emang kata abang gue perawatan mobil matic itu susah,neutral,neutral,neutral,neutral,neutral,negative
"lebih nyaman All New Avanza , lebih gesit . akselerasi lebih baik .",neutral,positive,neutral,neutral,neutral,neutral
Toyota Rush cocok untuk segala musim berjiwa petualang .,neutral,neutral,positive,neutral,neutral,neutral
"saya pengguna xpander , saya coba di tanjakan-tanjakan dieng dengan penumpang 6 orang dewasa , oke-oke saja kok . Dan memang mantap ini mobil",neutral,neutral,positive,neutral,neutral,neutral
memang bagus sih brio pantas laku keras,neutral,neutral,positive,neutral,neutral,neutral
"@iip_bados05 bengkel resmi toyota , honda , daihatsu itu standart nya lebih bagus dari bengkel biasa mas , so astrido punya toyota .",neutral,neutral,neutral,neutral,neutral,positive
"kalau mengutamakan desain sih ya mending brio saja, tapi kalau dari segi tenaga masih kurang",neutral,negative,neutral,positive,neutral,neutral
brio mobil nya jelek banget gak bagus .,neutral,neutral,negative,neutral,neutral,neutral
fortuner gaya nya stylish banget cocok buat kamu yang hobi main instagram,neutral,neutral,neutral,positive,neutral,neutral
"Naik honda beat , saya yang 180 cm berasa abang-abang naik troli bayi .",neutral,neutral,negative,neutral,neutral,neutral
kelemahan avanza power nya suka turun kalo sudah panas,neutral,negative,neutral,neutral,neutral,neutral
