sentence,fuel,machine,others,part,price,service
Menurut saya pribadi : Vario 150 2018 hanya ganti baju saja . Mesin dan rem kurang memuaskan karena tak ada peningkatan .,neutral,negative,neutral,negative,neutral,neutral
"kalau kata tukang bengkel , xenia adalah mobil irit . irit bensin ( dapat 1:12 ) .",positive,neutral,neutral,neutral,neutral,neutral
Kalo Ada HRV prestige .. pasti juara disini,neutral,neutral,positive,neutral,neutral,neutral
"Adik ku juga pakai hrv tetapi yang 1500 , kalau lagi nebeng di kursi belakang memang nyaman banget luas .",neutral,neutral,neutral,positive,neutral,neutral
"Tadi siang mampir ke dealer mobil Toyota Bintaro , nanya-nanya mobil avanza . Sales girl - nya pelayanan nya gak ramah banget . Orang kayak gitu dijadiin sales mobil",neutral,neutral,neutral,neutral,neutral,negative
Wuling Confero mobil nyaman buat keluarga .,neutral,neutral,positive,neutral,neutral,neutral
Honda HRV Cvt - nya lambat ( enggak tahu yang 1.8 ) .,neutral,neutral,neutral,negative,neutral,neutral
Suzuki All New Ertiga Kini Semakin Mahal,neutral,neutral,neutral,neutral,negative,neutral
Harga ignis sangat baik untuk harga mobil segitu,neutral,neutral,neutral,neutral,positive,neutral
"Toyota harga kemahalan , kualitas menurun , layanan purnajual menurun",neutral,neutral,negative,neutral,negative,negative
service toyota memang tidak pernah mengecewakan,neutral,neutral,neutral,neutral,neutral,positive
vario jauh lebih boros daripada mio,negative,neutral,neutral,neutral,neutral,neutral
Suspensi enak pajero sport bro bukan fortuner,neutral,neutral,neutral,negative,neutral,neutral
meskipun honda brio body nya oke tapi kalo mesin nya tidak bagus ya buat apa,neutral,negative,neutral,positive,neutral,neutral
"Toyota rush ini perawatan nya mudah , bengkel banyak di mana-mana .",neutral,neutral,neutral,neutral,neutral,positive
"Sampai saat ini brand mobil paling memuaskan gue secara keseluruhan : value , kualitas mobil , purnajual masih Toyota .",neutral,neutral,positive,neutral,positive,neutral
"suka sama brio karena lincah dan gesit banget untuk dibawa ke manapun, calya kalah jauh pokok nya",neutral,negative,neutral,neutral,neutral,neutral
"GL ini menurut saya, enak dikendarai dari perspektif pengemudi.",neutral,neutral,positive,neutral,neutral,neutral
Wuling cortez ini kayak nya nyaman banget sih daripada avanza,neutral,neutral,negative,neutral,neutral,neutral
cinta banget sama pilihan warna honda jazz yang bikin gemas,neutral,neutral,neutral,positive,neutral,neutral
"Kijang kapsul luas tetapi boros bensin , avanza irit tetapi sempit , huh",positive,neutral,neutral,negative,neutral,neutral
saya lebih ke mobilio karena dari segi tenaga lebih unggul,neutral,positive,neutral,neutral,neutral,neutral
"Mitsubishi ini mobil yang perawatan nya gampang , enak banget",neutral,neutral,neutral,neutral,neutral,positive
"mantep juga nih ketahanan mesin mobil nya wuling confero L, auto banyak yang beli buat taksi online.",neutral,positive,neutral,neutral,neutral,neutral
jazz tenaga nya oke banget daripada brio kalah jauh,neutral,negative,neutral,neutral,neutral,neutral
Saya lebih cenderung VRZ punya daya tarik tersendiri,neutral,neutral,positive,neutral,neutral,neutral
kelengkapan fitur sama kapasitas cc dan power yang lebih gede .. sirion lebih banyak keunggulan,neutral,positive,neutral,positive,neutral,neutral
"Saya pake all New Honda Brio Satya E gan , sangat nyaman dan good , apalagi brand nya H , beda dengan suzuki ignis dan Daihatsu sirion",neutral,neutral,negative,neutral,neutral,neutral
"Tolong dong dibenahi AHAS nya , masa saya mau servis motor dan ganti oli mekanik nya gak ada .",neutral,neutral,neutral,neutral,neutral,negative
Penilaian saya adalah Avanza ini mobil nyaris sempurna,neutral,neutral,positive,neutral,neutral,neutral
saya semakin yakin untuk pakai honda brio sebagai mobil sehari-hari karena menyenangkan untuk dikendarai .,neutral,neutral,positive,neutral,neutral,neutral
"kaki-kaki nyaman kabin dan bagasi juga luas banget , interior dan fitur juga terbilang bagus di kelas nya . Pokok nya senang lah pakai hrv",neutral,neutral,neutral,positive,neutral,neutral
"Beli Wuling Confero S dapat jasa servis 2,5 tahun enggak usah bayar .",neutral,neutral,neutral,neutral,neutral,positive
Mini masih kalah besar tenaga nya dibanding daihatsu ayla turbo,neutral,positive,neutral,neutral,neutral,neutral
Warna Avanza keluaran terbaru ini menambah mobil menjadi terlihat lebih modern,neutral,neutral,neutral,positive,neutral,neutral
"Xenia tahun 2008 dipakai selama 2 bulan bolak-balik jakarta - bandung , mesin tidak sekalipun bermasalah .",neutral,positive,neutral,neutral,neutral,neutral
"Semua tipe PCX 2018 keren apalagi yang PCX ABS . Keren banget model nya , bagus dan canggih mesin nya dan hemat BBM - nya .",positive,positive,positive,positive,neutral,neutral
"Kebetulan saya juga pakai HRV , namun pengalaman di bengkel resmi nya , banyak yang kurang menyenangkan . serta biaya servis nya agak mahal .",neutral,neutral,neutral,neutral,neutral,negative
"enggak menyangka sekelas SUV 1800 cc bahan bakar 1 banding 12 dalam kota , irit banget .",positive,neutral,neutral,neutral,neutral,neutral
City Car Daihatsu Satu Ini Ternyata Harga nya Tak Terlalu Mahal,neutral,neutral,neutral,neutral,positive,neutral
@Mitsubishi_ID Bengkel Matraman kurang bagus service mobil saya .,neutral,neutral,neutral,neutral,neutral,negative
Xpander bodi juga kaleng . Siapa bilang hanya rush doang yg kaleng,neutral,neutral,neutral,negative,neutral,neutral
Honda Brio RS CVT mantap bro . Cuma harga agak mahal saja sih,neutral,neutral,positive,neutral,negative,neutral
avanza mantep banget power nya buat dibawa ke jalanan tajam,neutral,positive,neutral,neutral,neutral,neutral
brio manuver nya lincah abis kalo dibanding sama calya,neutral,negative,neutral,neutral,neutral,neutral
purnajual kembali toyota rush juga masih bagus .,neutral,neutral,neutral,neutral,positive,neutral
Bengkel @Honda Terang anugrah pamulang payah pelayanan nya,neutral,neutral,neutral,neutral,neutral,negative
"Saya beli Avanza 2011 , untuk harga sangat ergonomis buat keluarga dan untuk konsumsi bensin nya irit .",positive,neutral,neutral,neutral,positive,neutral
"Suspensi agak keras , dan juga belum ada telescopic di setir , semoga ada perubahan di Terios ke depan nya , terima kasih .",neutral,neutral,neutral,negative,neutral,neutral
kalau yang aku rasakan sih performa avanza 1.5 lebih lincah dan lebih irit,positive,positive,neutral,neutral,neutral,neutral
Avanza sih harga nya murah nan ramah,neutral,neutral,neutral,neutral,positive,neutral
Honda vario ku murah perawatan rutin dan selalu termonitor kalau ada kekurangan satu dan lainnya dapat terdeteksi secara cepat dan bahkan banyak tempat servis yang tersebar menjadikan mudah dalam pemeliharaan nya .,neutral,neutral,neutral,neutral,neutral,positive
udah delapan bulan baru jadi lama bener,neutral,neutral,neutral,neutral,neutral,negative
Agak kemahalan ya untuk sekelas brio,neutral,neutral,neutral,neutral,negative,neutral
Konsumsi bahan bakar Avanza cukup irit,positive,neutral,neutral,neutral,neutral,neutral
"xenia li saya , tahun 2006 akhir dah vvti bunyi mesin nya kasar kalau posisi diam . kayak diesel gitu .",neutral,negative,neutral,neutral,neutral,neutral
"Dari semua merek mobil yang pernah saya pakai , terios baru ini lumayan boros .",negative,neutral,neutral,neutral,neutral,neutral
"Mini cooper , mobil stylish yang mendekati sempurna",neutral,neutral,positive,neutral,neutral,neutral
Memiliki mesin dual VVTI dan sistem penggerak roda belakang membuat Daihatsu Great New Xenia punya keunggulan dalam efisiensi dan kemudahan perawatan nya .,positive,neutral,neutral,neutral,neutral,positive
Aku sudah test drive dan merasakan tarikan yang cukup mantap di mobil wuling ini .,neutral,positive,neutral,neutral,neutral,neutral
mesin wuling confero ini tidak berisik,neutral,negative,neutral,neutral,neutral,neutral
"Fortuner kalau dilihat harga nya memang menjulang tinggi . tetapi di balik harga itu , kualitas yang diberikan juga bagus .",neutral,neutral,positive,neutral,negative,neutral
ampun deh punya xenia uang habis cuma buat konsumsi bensin,negative,neutral,neutral,neutral,neutral,neutral
Wah kayak nya si wuling formo ini kurang meyakinkan buat tunggangan besi harian.,neutral,neutral,negative,neutral,neutral,neutral
"Toyota Rush saya , konsumsi bahan bakar nya cukup irit .",positive,neutral,neutral,neutral,neutral,neutral
"harga nya terbilang murah dengan fitur dan desain yang cukup keren , suzuki baleno 2017",neutral,neutral,neutral,positive,positive,neutral
"ya benar kak , kelemahan mobilio cuma 1 , di mesin nya kalau kecepatan di atas 100 kph , memang berisik banget sih .",neutral,negative,neutral,neutral,neutral,neutral
"Hmm pelayanan nya not recommended lah , masih lebih bagus bengkel non-resmi ( @ Astra International Daihatsu ( Pondok Cabe ))",neutral,neutral,neutral,neutral,neutral,negative
"wah , juragan xenia li 2004 saya dulu 5 tahun belum ganti ban . masih tebal semua",neutral,neutral,neutral,positive,neutral,neutral
"Perubahan minor ya wajar gak naik harga , gak naik harga aja penjualan minim apa lagi naik harga . Pabrikan jepang sama2 aja pelit nya ....",neutral,neutral,neutral,neutral,negative,neutral
Gue lebih milih honda karena minim perawatan dan suku cadang yang awet dan murah,neutral,neutral,neutral,positive,neutral,positive
livina di tempat gue bensin nya asli boros banget kalau soal ngelitik memang iya,negative,negative,neutral,neutral,neutral,neutral
saya pilih xi+ karena ternyata irit nya enggak beda jauh .,positive,neutral,neutral,neutral,neutral,neutral
Wuling Formo 1.2 Standard yang ramah untuk penumpang.,neutral,neutral,positive,neutral,neutral,neutral
Xenia dengan pegangan pintu nya yang diposisikan tengah menurut saya sendiri kurang suka sih,neutral,neutral,neutral,negative,neutral,neutral
Kalau rush banyak jeroan nya jadi berat tetapi stabil .,neutral,positive,neutral,negative,neutral,neutral
"Veloz keluaran Toyota ternyata enak dipake , nyaman , pesan dari dealer juga gak lama inden nya , thanks toyota :D",neutral,neutral,positive,neutral,neutral,positive
@Auto2000ID maaf kenapa ya mobil ya setelah di servis di dealer toyota sekarang mobil nya jadi susah di starter ? Dan sering mati mati,neutral,neutral,neutral,neutral,neutral,negative
Mobil xenia mantap irit pula . untuk perawatan nya mesin nya lumayan murah .,positive,neutral,positive,neutral,neutral,positive
"setelah membeli toyota calya , saya merasakan banyak lagi kelebihan nya .",neutral,neutral,positive,neutral,neutral,neutral
"Dari segi harga terlalu mahal , mengingat harga Sparepart Mitsubishi Xpander selangit .",neutral,neutral,neutral,neutral,negative,neutral
yang paling cocok untuk wanita karir memang calya dari segi desain karena mungil tapi tetap terlihar stylish,neutral,neutral,neutral,positive,neutral,neutral
"Enak juga bengkel Toyota di margonda ini . Semua petugas ramah dan helpful , layanan cepat , dan dapat kopi gratis .",neutral,neutral,neutral,neutral,neutral,positive
"Sebelum ramadhan 2014 , saya ganti accu di bengkel honda Jakarta center , jayakarta . Belum setahun , sudah soak . Payah",neutral,neutral,neutral,neutral,neutral,negative
harga unit mobil GL kemahalan,neutral,neutral,neutral,neutral,negative,neutral
"pakai rush trd enak banget dari bangku , kaki-kaki enak dan saya bawa lari dengan kecepatan hampir 140 km / jam Tidak limbung dan masalah bensin irit banget dan ac dingin",neutral,positive,neutral,positive,positive,neutral
Pakai Altis v enggak boros-boros amat sih,positive,neutral,neutral,neutral,neutral,neutral
"Apalagi Kalau perjalanan Jauh , dengan bensin yang irit banget bagi saya begitu performa yang stabil , avanza adalah mobil idaman bagi saya Dan juga keluarga besar saya .",positive,positive,neutral,neutral,neutral,neutral
"Yang saya enggak suka , kalau saya duduk di belakang , kepala mentok dengan atap dengan tinggi 183 cm . Duduk di posisi mengemudi , rambut saya kena plafon mobil jadi kurang nyaman .",neutral,neutral,neutral,negative,neutral,neutral
Saya pribadi lebih suka sama design luar dalam CX3,neutral,neutral,neutral,positive,neutral,neutral
Bagusan Fortuner daripada Pajero sport,neutral,neutral,negative,neutral,neutral,neutral
Sejauh ini belum ne mu bengkel resmi mitsubishi yang pelayan nya ' bagus ',neutral,neutral,neutral,neutral,neutral,positive
Toyota lebih unggul dari mitsubishi secara worldwide termasuk di Indonesia,neutral,neutral,negative,neutral,neutral,neutral
"Toyota Innova suspensi nya sangat mantap , tidak pernah rewel mesin nya karena rutin diservis .",neutral,positive,neutral,positive,neutral,neutral
"Gue pakai HRV juga dan udah 2 tahun , jujur enggak suka sih sama ini mobil .",neutral,neutral,negative,neutral,neutral,neutral
Rush cocok untuk segala medan,neutral,neutral,positive,neutral,neutral,neutral
"xenia li sudah ada power window , tachometer , power steering",neutral,neutral,neutral,positive,neutral,neutral
"Khusus Xenia , ada pengalaman tahun 2008 digunakan oleh tim proyek . selama 2 bulan , Jakarta - Bandung setiap 2 hari via tol . Tidak ada keluhan sedikit pun .",neutral,neutral,positive,neutral,neutral,neutral
Altis G MT jadi tunggangan nyaman .,neutral,neutral,positive,neutral,neutral,neutral
keseluruhan saya suka dengan Terios .,neutral,neutral,positive,neutral,neutral,neutral
Pengalaman hrv 1.5 e cvt . Sangat tidak puas,neutral,neutral,negative,neutral,neutral,neutral
Semoga berkembang toyota biar gk ditinggalin customer nya satu per satu,neutral,neutral,negative,neutral,neutral,neutral
Xpander pokok nya terbaik di kelas nya .,neutral,neutral,positive,neutral,neutral,neutral
Puas banget coi punya Xpander mah .,neutral,neutral,positive,neutral,neutral,neutral
Xi 2005 hebat banget nih mobil . kuat pakai premium ( 1:11 ) irit abis,positive,neutral,positive,neutral,neutral,neutral
"keseluruhan gue suka xenia . Murah , desain lucu , muat banyak barang ,",neutral,neutral,positive,positive,positive,neutral
"Coba dong ke Honda Autoland Kelapa Gading , beda benar . Pelayanan , kualitas ruang tunggu dan lain-lain yang enggak banget .",neutral,neutral,neutral,neutral,neutral,negative
"Ayah saya tahu karakter mesin , dia bilang karakter mesin nya calya oke",neutral,positive,neutral,neutral,neutral,neutral
calya didesain dapat dipakai untuk semua kalangan usia,neutral,neutral,neutral,positive,neutral,neutral
Jazz VTEC Lama saja lebih murah,neutral,neutral,neutral,neutral,positive,neutral
avanza dapat bermanuver lincah mesin nya,neutral,positive,neutral,neutral,neutral,neutral
avanza lincah banget kalo buat lari meskipun gaya nya jadul abis hehe,neutral,positive,neutral,negative,neutral,neutral
"Saya dapat harga cuma 118 juta juli 2015 . lumayan murah banget si Wagon , awet , irit .",positive,neutral,positive,neutral,positive,neutral
saya akan pilih all new grand livina . jelas lebih nyaman . lebih mewah . lebih keren . mobil nya anak muda lagi .,neutral,neutral,positive,neutral,neutral,neutral
Elektronik Parking Brake HRV sudah oke banget .,neutral,neutral,neutral,positive,neutral,neutral
"Seperti inilah rasa mengendarai Nissan GT - R R35 "" Godzilla "" bertenaga 537 hp dengan torsi 612 Nm yang sungguh kencang",neutral,positive,neutral,neutral,neutral,neutral
mobil bagus irit bahan bakar dan murah ya brio,positive,neutral,positive,neutral,positive,neutral
Honda Brio ini mobil yang lumayan keren sih memang,neutral,neutral,positive,neutral,neutral,neutral
masalah nopol aja lama sekali mengurus nya kecewa sama nissan,neutral,neutral,neutral,neutral,neutral,negative
"Motor beat paling nyaman , dipakai untuk perempuan seperti saya , apalagi dibawa ke mana-mana sangat irit dan harga nya terjangkau dibandingkan motor honda yang lain .",neutral,neutral,positive,neutral,positive,neutral
"HRV prestige akhir tahun 2017 bagasi luas , bbm irit bisa 1:12 , jok kulit , lampu led enak kalau dipakai malam hari .",positive,neutral,neutral,positive,neutral,neutral
"dengan harga cuma 70 - 80 juta dapat mobil yang sangat nyaman , cuma Altis yang bisa",neutral,neutral,positive,neutral,positive,neutral
suka banget sama fitur Paddle shift - nya HRV E 2018 kayak mobil balap kalau bawa di tol suara mesin nya .,neutral,positive,neutral,positive,neutral,neutral
"Xenia yang saya pakai dari 2005 ini biaya perawatan yang rendah dan keandalan mesin yang tinggi ,",neutral,positive,neutral,neutral,neutral,positive
HRV nyaman terutama pas menyetir malam karena lampu nya terang ( double LED ) dan yang jelas irit .,positive,neutral,positive,positive,neutral,neutral
harga jual Nmax pun bersaing,neutral,neutral,neutral,neutral,positive,neutral
"Dengan sigra perjalanan lebih nyaman, budget bensin bisa dialokasikan untuk keperluan lain.",positive,neutral,positive,neutral,neutral,neutral
"Kalau untuk secara desain , interior dan fitur Honda mumpuni okelah .",neutral,neutral,neutral,positive,neutral,neutral
"Ke Bengkel itu buat ngebenerin motor bukan malah bikin motor jadi rusak , payah nih Dealer Honda Cidodol , masa motor gua bener jadi rusak .",neutral,neutral,neutral,neutral,neutral,negative
kemahalan ya agya kalau untuk keluarga dengan ekonomi pas-pasan,neutral,neutral,neutral,neutral,negative,neutral
Kalo soal irit dan perawatan sih tetep prefer ke supra x helm in .,positive,neutral,neutral,neutral,neutral,positive
sigra nih menemani jalan-jalan bersama keluarga. Ku bangga dengan mobil ini.,neutral,neutral,positive,neutral,neutral,neutral
"Mobil ku daihatsu xenia ku irit , cocok banget buat keluarga indonesia dengan kursi 7 tambah lagi mesin handal ( 1.300 cc ) walau sudah sejak 2009",positive,positive,neutral,positive,neutral,neutral
Puas ketika pertama kali membeli dan memakai Toyota Calya ini sampai sekarang,neutral,neutral,positive,neutral,neutral,neutral
Kerenan pajero lah yang setuju like ya,neutral,neutral,positive,neutral,neutral,neutral
Lebih ok pajero .... lebih jantan,neutral,neutral,positive,neutral,neutral,neutral
"Saya pakai motor vario sangat nyaman , rem sangat pakem , Suara mesin montor masih halus , padahal setiap bulan dibuat jalan luar provinsi tetapi masih tetap nyaman .",neutral,positive,positive,positive,neutral,neutral
Tergantung mau pakai nya berapa lama . Kalau 2 - 3 tahun mau ganti mending brio bro karena harga honda turun enggak jauh-jauh amat .,neutral,neutral,neutral,neutral,positive,neutral
"tetapi selama yang saya lihat kalau xenia avanza tubruk ( adu kambing ) , bagian kabin kelihatan masih kokoh .",neutral,neutral,neutral,positive,neutral,neutral
Rush dan terios tampilan saja bagus tetapi kualitas murahan . mendingan beli cortez nyaman dibawa dan murah .,neutral,neutral,positive,positive,positive,neutral
"Alasan saya pilih HRV karena butuh mobil yang jangkung , lega di kelas nya , dan model nya ganteng .",neutral,neutral,neutral,positive,neutral,neutral
"honda jazz full power banget, body mantep, suspensi empuk dan nyaman.",neutral,positive,neutral,positive,neutral,neutral
Nama Toyota dan Honda di indonesia melegenda ... walaupun mahal orang mau beli ... kata nya Spert part nya murah padahal kualitas nya abal2 ... di ketok dikit langsung penyot body nya dan dasbor nya,neutral,neutral,neutral,negative,neutral,neutral
Xenia perawatan berkala nya tidak mahal .,neutral,neutral,neutral,neutral,neutral,positive
jelek banget ini xenia li menesal saya beli,neutral,neutral,negative,neutral,neutral,neutral
jujur saja tenaga nya Mobilio lebih besar yang manual dan akselerasi nya lebih cepat,neutral,positive,neutral,neutral,neutral,neutral
"Beat street dari bentukan keren banget , eye catching , dari performa juga lumayan untuk motor seharga nya , mesin senyap dan benar-benar halus .",neutral,positive,neutral,positive,neutral,neutral
Brio saya kondisi mesin bisa dibilang masih sempurna masih bisa 28 km / liter dan digas ke 120 kmh 140 kmh juga masih enteng .,neutral,positive,neutral,neutral,neutral,neutral
"suspensi pajero empuk , fortuner itu suspensi nya keras",neutral,neutral,neutral,negative,neutral,neutral
Menurut saya mobil xpander ini sangat nyaman dan keren,neutral,neutral,positive,neutral,neutral,neutral
komplit sekali servis yang ditawarkan toyota semua nya ada pokok nya paket lengkap,neutral,neutral,neutral,neutral,neutral,positive
Avanza sangat mendukung profesi yang saya jalani karena avanza bagi saya volume ruang yang besar .,neutral,neutral,neutral,positive,neutral,neutral
mobil mitsubishi sekarang sudah gratis biaya servis dan sparepart selama 5 tahun .,neutral,neutral,neutral,positive,neutral,positive
Rush 2018 G AT cocok untuk kalangan tua dan muda . tiada lagi tandingan nya .,neutral,neutral,positive,neutral,neutral,neutral
Hanya honda beat yang sudah terbukti mantap dan dahsyat.,neutral,neutral,positive,neutral,neutral,neutral
harga jual pun bersaing . untuk saat ini Nmax jadi motor ini paling nyaman digunakan baik untuk harian maupun tur .,neutral,neutral,positive,neutral,positive,neutral
Waduh kece parah deh ini bisa-bisa kepincut saya sama wuling cortez,neutral,neutral,positive,neutral,neutral,neutral
"Dari pengalaman sendiri pakai mitsubishi , lampu kayak kurang terang itu karena kaca film standar terlalu gelap yang depan .",neutral,neutral,neutral,negative,neutral,neutral
"Pernah Punya Grand Livina XV tahun 2011 dipakai sampai 5 Tahun , dan KM - nya enggak sampai 50.000 . Sumpah ini mobil nyaman banget .",neutral,neutral,positive,neutral,neutral,neutral
cukup puas dengan toyota rush ini,neutral,neutral,positive,neutral,neutral,neutral
"saya juga baru saja beli tipe deluxe juga , bensin lumayan irit kok kak .",positive,neutral,neutral,neutral,neutral,neutral
Bengkel resmi Yamaha menjual suku cadang dengan harga yang jauh lebih mahal.,neutral,neutral,neutral,neutral,neutral,negative
Xeli tenaga nya juga enggak memalukan,neutral,positive,neutral,neutral,neutral,neutral
Bengkel payah . Mobil 3 bulan gak dikerjain juga . Bengkel yang mengecewakan ( @ Honda Prima Bekasi ),neutral,neutral,neutral,neutral,neutral,negative
"xpander memang oke , enak saja menanjak 6 orang dalam mobil .",neutral,neutral,positive,neutral,neutral,neutral
"All new Avanza punya rasio gigi lebih halus . kabin lebih lega , buat baris 1 - 2 .",neutral,neutral,neutral,positive,neutral,neutral
"nmax lebar sih . cuma Honda kalau soal servis masih lebih aman ,",neutral,neutral,neutral,positive,neutral,positive
Masih nyaman Pajero karna Pajero lebih banyak peminat nya dari pada Fortuner,neutral,neutral,negative,neutral,neutral,neutral
"4 tahun pakai Altis , irit bbm banget apalagi buat luar kota",positive,neutral,neutral,neutral,neutral,neutral
Sudah 4 tahun lebih pakai mobil Honda ini . benar-benar mantap ! Pantas jadi MOBIL SEJUTA UMAT nya sedunia . Tidak pernah mengalami masalah sama sekali .,neutral,neutral,positive,neutral,neutral,neutral
"Gue cuma punya setahun Grand Livina, cuma dipakai ke Bali, tenaga nya lemot banget.",neutral,positive,neutral,neutral,neutral,neutral
"Tetapi menurut saya honda masih terlalu pelit untuk ac - nya ,",neutral,neutral,neutral,negative,neutral,neutral
Toyota Avanza versi terbaru pun menghadirkan pedal gas yang lebih ringan untuk diinjak sehingga anda bisa memperoleh tingkat kenyamanan lebih mudah .,neutral,neutral,neutral,positive,neutral,neutral
Wah bengkel toyota pelayanan nya bagus banget nih . ini sih nunggu berjam-jam di bengkel juga gak bakal bosen kalo semuanya disediain di sini :D,neutral,neutral,neutral,neutral,neutral,positive
jazz tarikan nya jauh lebih halus daripada brio,neutral,negative,neutral,neutral,neutral,neutral
"Toyota Fortuner adalah kendaraan yang benar-benar di atas harapan . Setelah beberapa lama menggunakan nya , konsumsi bahan bakar kendaraan ini cukup baik dan bisa diandalkan .",positive,neutral,positive,neutral,neutral,neutral
Jazz enak . tetapi mahal harga dan perawatan gila .,neutral,neutral,positive,neutral,negative,negative
gue enggak menyangka xpander bisa sebagus ini .,neutral,neutral,positive,neutral,neutral,neutral
fortuner sempit di belakang kalau pajero luas duduk nya ga mentok,neutral,neutral,neutral,positive,neutral,neutral
"mesin 3SZ - VE 1500 cc ini memang lebih pas di badan Avanza , bertenaga namun efisien",neutral,positive,neutral,neutral,neutral,neutral
ane tetep megang mobilio daripada avanza . . ga enak banget avanza .. rasa berkendara nya enakan mobilio ..,neutral,neutral,positive,neutral,neutral,neutral
Saya juga pakai hrv om . impresi nya sangat luar biasa dan enak banget dikendarai baik dalam dan luar kota hrv terbaik,neutral,neutral,positive,neutral,neutral,neutral
"Kenapa saya suka dengan mobil Avanza , karena selain nyaman mobil ini mesin nya juga terpelihara dan terjaga . Jadi apabila kita hendak pergi ke luar kota atau pergi jauh mesin nya tetap awet .",neutral,positive,positive,neutral,neutral,neutral
Toyota Rush irit,positive,neutral,neutral,neutral,neutral,neutral
Mending Calya harga stabil,neutral,neutral,neutral,neutral,positive,neutral
sebagai jiwa petualang saya yakin beli brio karena lincah kalau untuk lari,neutral,positive,neutral,neutral,neutral,neutral
"Wuling confero , mesin gardan oke dan mantap , mesin andal di kelas nya ,",neutral,positive,neutral,neutral,neutral,neutral
@hondajazz_id pelayanan bengkel honda pluit jelek,neutral,neutral,neutral,neutral,neutral,negative
"grand livina cuma menang di interior, mesin tetap kalah.",neutral,negative,neutral,positive,neutral,neutral
"tapi mazda kadang mahal , harga purnajual enggak seberapa",neutral,neutral,neutral,neutral,negative,neutral
layanan Purnajual Toyota Dinilai Paling Memuaskan,neutral,neutral,neutral,neutral,neutral,positive
Gue punya selis sudah 4 tahun. masih awet. batre sama kontroler nya enggak pernah masalah.,neutral,neutral,positive,positive,neutral,neutral
avanza bahan bakar nya boros banget,negative,neutral,neutral,neutral,neutral,neutral
"Lagi mikir , mobil murah dan perawatan mudah kan Avanza , tapi kok gak ada perusahaan taksi yang pake ya ? Kan enak penumpang nya bisa 6 orang .",neutral,neutral,neutral,neutral,positive,positive
