sentence,fuel,machine,others,part,price,service
"kemarin gue dapat grab pakai xpander exceed , ternyata jauh lebih nyaman .",neutral,neutral,positive,neutral,neutral,neutral
"pakai hr - v 1.8 merasakan juga kalau mobil ini kabin nya luas , interior nya bagus .",neutral,neutral,neutral,positive,neutral,neutral
"Harga yang murah , tapi mesin Avanza bagus juga .",neutral,positive,neutral,neutral,positive,neutral
Harga nya honda brio rs sayang terlalu mahal menurut saya pribadi .,neutral,neutral,neutral,neutral,negative,neutral
"Kualitas produk , teknologi , hingga suku cadang yang terjamin juga menjadi aspek yang memengaruhi daya tarik Avanza ini juragan",neutral,neutral,positive,positive,neutral,neutral
"kalau ada budget lebih pilih Xi saja , tarikan lebih enak dan bertenaga ,",neutral,positive,neutral,neutral,neutral,neutral
Avanza sangat mendukung profesi yang saya jalani karena bagi seorang mahasiswa seperti saya .,neutral,neutral,positive,neutral,neutral,neutral
karakter mesin livina kencang di high rpm atau jarak jauh .,neutral,positive,neutral,neutral,neutral,neutral
Avanza keren banget ini mobil . daya tahan mesin nya enggak diragukan . di tanjakan enggak memalukan .,neutral,positive,positive,neutral,neutral,neutral
"2018 awal mencoba altis gen 11 facelift , rasanya ini mobil makin-makin irit saja .",positive,neutral,neutral,neutral,neutral,neutral
"Lawak banget ini ahass honda , cuma setengah hari , ini baru jam 10 , udah gak nerima servis motor lagi ,",neutral,neutral,neutral,neutral,neutral,negative
Rush 2018 varian G AT irit bahan bakar .,positive,neutral,neutral,neutral,neutral,neutral
"Bingung kalo di bengkel takut nya jelek , kalau servis di honda mahal",neutral,neutral,neutral,neutral,neutral,negative
brio punya fitur keamanan tingkat tinggi yang enggak dimiliki 86 yaitu speed limiter di 145 km / h,neutral,neutral,neutral,positive,neutral,neutral
Lama banget kerja nya teknisi honda !! Masa iya udah 20 antrean belom disentuh-sentuh motor ku ? Dari jam 10 woi ! Emang kalo servis itu bagus yamaha !,neutral,neutral,neutral,neutral,neutral,positive
"Tenaga emang ok , tapi desain pajero kayak banci ... kurang gagah model pajero",neutral,positive,neutral,negative,neutral,neutral
inden fortuner cepat sekali datangnya cukup 1 bulan saja,neutral,neutral,neutral,neutral,neutral,positive
"bebek & xenia sama-sama irit juragan , pokok nya Xenia nih",positive,neutral,neutral,neutral,neutral,neutral
Punya beat injeksi irit nya minta ampun dipakai buat kencang juga oke tetapi setir kadang goyang-goyang kayak ban kempes,positive,neutral,neutral,negative,neutral,neutral
saya setuju vario jauh lebih enak dibanding mio,neutral,neutral,negative,neutral,neutral,neutral
baru beberapa bulan pakai nmax kok sudah bosan ya .,neutral,neutral,negative,neutral,neutral,neutral
"MOBIL ku xenia 1,3 cc puas banget pakai nya .",neutral,neutral,positive,neutral,neutral,neutral
vario pokoknya lebih bagus daripada mio dalam segala hal,neutral,neutral,negative,neutral,neutral,neutral
Xenia kata nya sih lebih irit dan jangan lupa pajak mobil ditentukan juga oleh CC kendaraan,positive,neutral,neutral,neutral,neutral,neutral
fun to drive memang honda brio masih lebih fun dari sirion,neutral,neutral,negative,neutral,neutral,neutral
saya sebener nya juga pengen punya mobil rush dengan desain yang sporty,neutral,neutral,neutral,positive,neutral,neutral
"Bengkel Honda 0001 , ga rekomendasi !! Jelek",neutral,neutral,neutral,neutral,neutral,negative
kijang innova pokok nya juara mobil mewah tetapi harga nya tidak mahal,neutral,neutral,positive,neutral,positive,neutral
"Honda Vario 125 2018 sangat nyaman dipakai ya , buat menyalip juga enak , mesin nya halus dibandingkan dengan vario lama",neutral,positive,positive,neutral,neutral,neutral
"Sudah bensin nya irit , mesin nya bandel . perjalanan semakin lancar . harga jual tidak jatuh , dibanding dengan merek yang lain .",positive,positive,neutral,neutral,positive,neutral
"Perasaan liat di jalan veloz ini padahal baru tapi liat nya biasa aja ya , kurang greget",neutral,neutral,negative,neutral,neutral,neutral
"Saya pakai grand livina dari 2008 , km udah hampir 400 ribu . Masih nyaman-nyaman saja , dan irit .",positive,neutral,positive,neutral,neutral,neutral
"nih mobil mantap , diajak mengejar innova masih sanggup . cuma bodi nya saja nih , kurang rigid . kalau dibawa lari di tol melayang .",neutral,neutral,positive,negative,neutral,neutral
Tetep kalah telak sama pajero sport,neutral,neutral,positive,neutral,neutral,neutral
Harga murah adalah salah satu kelebihan Toyota Calya,neutral,neutral,neutral,neutral,positive,neutral
Rush merupakan SUV menengah yang sangat menarik,neutral,neutral,positive,neutral,neutral,neutral
"Isuzu Panther Grand Touring Tahun 2009 . Mobil tangguh dengan mesin diesel yang irit dan bandel , harga nya cuma 167 Jutaan juragan .",positive,positive,neutral,neutral,positive,neutral
satu hal yang mungkin dirasa kurang dari xenia ialah dengan beban penuh kapasitas tenaga mobil dirasa kurang maksimal,neutral,negative,neutral,neutral,neutral,neutral
scoopy tidak cocok untuk mahasiswa,neutral,neutral,negative,neutral,neutral,neutral
mantab review nya ... bener sih kalo masalah handling ga diragukan lagi .. membuat brio fun to drive,neutral,neutral,positive,positive,neutral,neutral
"mobil toyota avanza mobil yang murah , tetap tidak murahan .",neutral,neutral,neutral,neutral,positive,neutral
Mobil yang ga pernah gw lirik di jalanan ... mobilio dan brv ... design nya semrawut .. jelek pol,neutral,neutral,neutral,negative,neutral,neutral
Avanza menjadi lebih praktis dipakai di beragam rute dengan kondisi jalan yang sempit juragan .,neutral,neutral,positive,neutral,neutral,neutral
Fortuner kalo kalian pilih itu pasti ngga bakal nyesel fortuner itu canggih,neutral,neutral,positive,neutral,neutral,neutral
yang saya enggak suka dari terios itu kaki-kaki nya yang kurang kuat dan berisik sekali,neutral,neutral,neutral,negative,neutral,neutral
"punya motor yamaha tidak pernah membuat pusing , karena perawatan yang simple dan murah , serta tak butuh waktu . @YamahaIndonesia #40thYamaha",neutral,neutral,neutral,neutral,neutral,positive
Tapi bengkel honda yang di deket ring road ini jelek :|,neutral,neutral,neutral,neutral,neutral,negative
"cukup impresif , dari sisi harga , kelengkapan dan tentunya engine yang pakai 4 cylinder , saya percaya bakal laku keras .",neutral,neutral,neutral,neutral,positive,neutral
Keseluruhan kecewa berat sama honda HRV,neutral,neutral,negative,neutral,neutral,neutral
Toyota rush enak dipakai sehari-hari dalam kota dan santai untuk dipakai mudik .,neutral,neutral,positive,neutral,neutral,neutral
"kebetulan gue juga pakai livina dari 2010 . keluhan nya sama , mesin ngelitik padahal sudah bolak-balik beres berapa kali .",neutral,negative,neutral,neutral,neutral,neutral
jazz lebih bandel kalo dibanding brio,neutral,negative,neutral,neutral,neutral,neutral
"Jangan mau servis di bengkel Toyota, mahalnya kebangetan, pelayanan tidak memuaskan.",neutral,neutral,neutral,neutral,neutral,negative
"jangan beli brio, kenyamanan nya jelek banget, mending calya selalu enak dibuat ke mana mana .",neutral,neutral,positive,neutral,neutral,neutral
jangan beli mobil produk @DaihatsuInd terutama mobil Xenia karena mesin nya mudah meledak .,neutral,negative,neutral,neutral,neutral,neutral
"Untuk bagian safety and security , Grand New Avanza memiliki berbagai fitur yang mendukung keamanan dan keselamatan .",neutral,neutral,neutral,positive,neutral,neutral
Liburan Ke Bali berempat dengan wuling confero s lux+ . BBM yang sangat irit,positive,neutral,neutral,neutral,neutral,neutral
Terios ini mobil cocok untuk semua medan,neutral,neutral,positive,neutral,neutral,neutral
"Vario ban sudah tubeless dan bensin yang irit ditambah bagasi yang lega , bikin hati gembira dan spirit bahagia .",positive,neutral,neutral,positive,neutral,neutral
"konsumsi bahan bakar Honda mobilio tipe e cvt prestige cukup irit yaitu 14,2 km / liter dengan kecepatan 40 - 60 km / jam .",positive,neutral,neutral,neutral,neutral,neutral
Calya mobil nya irit bahan bakar saya isi penuh bisa buat berkeliling-keliling kota-kota jadi enggak sering mampir ke spbu,positive,neutral,neutral,neutral,neutral,neutral
SUZUKI ertiga mobil murah tetapi tidak murahan dilihat interior nya mantap .,neutral,neutral,neutral,positive,positive,neutral
Toyota maju dong jgn gitu gitu terus harga mahal tp apa yg di dapet dikit bgt,neutral,neutral,negative,neutral,negative,neutral
"Bengkel mobil Honda yang di Autoland kalau ada problem serius dan kelihatannya akan bebas dari biaya , mereka pasti menolak servis .",neutral,neutral,neutral,neutral,neutral,negative
Fortuner Mobil irit bahan bakar dan nyaman hanya menggunakan biosolar mobil berjalan dengan sempurna dan terbukti dari Jakarta sampai Surabaya dua kali isi solar dan itupun masih bisa dipakai keliling kota Surabaya .,positive,neutral,positive,neutral,neutral,neutral
"Pokok nya yamaha keren banget semakin di depan tetap yang terbaik motor nya nyaman dipakai , mesin nya halus , mau pria atau perempuan cocok deh pakai yamaha",neutral,positive,positive,neutral,neutral,neutral
Saya tunggu bertahun-tahun . kapan nih Daihatsu Sukabumi punya bengkel yang layak seperti Toyota dan Honda . yang ada sekarang jelek bukan main,neutral,neutral,neutral,neutral,neutral,negative
"Avanza lari nya juga lumayan kencang , di tol bisa mencapai 140 km / h.",neutral,positive,neutral,neutral,neutral,neutral
"buat bensin fortuner enggak usah ditanya , saya isi penuh hari minggu , dan itu bisa dipakai sampai dua minggu ke depan . irit banget kan !",neutral,positive,neutral,neutral,neutral,neutral
Paling ok buat jalur semi off road dan tanjakan Terios,neutral,positive,neutral,neutral,neutral,neutral
"dengan desain aerodinamis , yang membuat mobil Grand New Veloz sangat mudah dikendalikan ,",neutral,neutral,neutral,positive,neutral,neutral
mobilio bagus purnajual juga oke,neutral,neutral,positive,neutral,positive,neutral
Hrv punya tetangga saya kok shock depan keras ya .,neutral,neutral,neutral,negative,neutral,neutral
"Menurut saya untuk harga mobil sekelas nya , sampai saat ini mungkin IGNIS ini yang paling value for money .",neutral,neutral,neutral,neutral,positive,neutral
vario jauh lebih gesit daripada mio,neutral,negative,neutral,neutral,neutral,neutral
Rush 2018 saya varian G AT suara mesin kasar .,neutral,negative,neutral,neutral,neutral,neutral
"Avanza cuma menghabiskan sekitar 40 liter bensin untuk 700 km , bung . Irit parah ini sih .",positive,neutral,neutral,neutral,neutral,neutral
"Berarti Karimun Wagon R referensi nih bang , kebetulan lagi cari LCGC yang murah meriah harga pasaran nya",neutral,neutral,neutral,neutral,positive,neutral
hati-hati aja mobilio purnajual nya suka jatuh,neutral,neutral,neutral,neutral,negative,neutral
"banyak hal menarik di mobil toyota calya ini , harga nya murah",neutral,neutral,neutral,neutral,negative,neutral
Kawasaki Athlete terasa klasik tetapi kurang menarik . kayak setengah-setengah,neutral,neutral,negative,neutral,neutral,neutral
"Kesimpulan selama pake Fortuner VRZ kenyamanan perlu banget , interior indah jelas bikin betah di mobil",neutral,neutral,positive,positive,neutral,neutral
Ini mobil avanza lebih boros daripada mobil BMW,positive,neutral,neutral,neutral,neutral,neutral
Selain elegan motor juga keren buat anak muda atau pun orang tua selain itu perawatan juga sangat mudah dan ditambah onderdil juga murah membuat saya mengagumi produk honda selain itu juga irit bahan bakar dengan mesin injeksi membuat mesin lebih awet dan tangguh buat perjalanan jauh pun mesin tetep oke,positive,positive,neutral,positive,neutral,positive
"Bagus kali pelayanan astra daihatsu jalan sisingamangaraja ini . Servis mobil ganti oli , dapat cuci gratis !",neutral,neutral,neutral,neutral,neutral,positive
Kegoblokan Nissan di GL ini mesin enggak dikasih Knock Sensor ( cuma alat satu doang pelit banget ) .,neutral,negative,neutral,neutral,neutral,neutral
Harga murah kualitas terjamin ertiga memang mobil yang mantap jaya,neutral,neutral,positive,neutral,positive,neutral
Asli avanza saya boros akhir-akhir ini,negative,neutral,neutral,neutral,neutral,neutral
"Setelah penggunaan beberapa waktu, motor ini sangat nyaman, empuk sekali melewati jalanan rusak, seperti lempeng begitu saja tanpa ada guncangan yang berarti.",neutral,neutral,positive,neutral,neutral,neutral
dengan menggunakan avanza yang super irit . pengeluaran saya pun bisa terjangkau .,positive,neutral,neutral,neutral,neutral,neutral
"nih mobil kalau dibawa mudik pasti nyaman, badan enggak pegal-pegal.",neutral,neutral,positive,neutral,neutral,neutral
"Saya berombongan pakai xenia 1.0 , ternyata tenaga xenia 1.0 juga oke punya",neutral,positive,neutral,neutral,neutral,neutral
sigra juga kuat power nya untuk dibawa kebut-kebutan di jalan lintas sumatra yang kejam.,neutral,positive,neutral,neutral,neutral,neutral
"gue pakai xenia li VVTi 2007 , ya sadar sajalah punya mobil murah meriah 1000 cc tuh",neutral,neutral,neutral,neutral,positive,neutral
"Yamaha Nmax perawatan motor tidak ribet , dan harga nya terjangkau .",neutral,neutral,neutral,neutral,positive,positive
keunggulan mobil Avanza terbaru adalah sparepart - nya yang mudah dicari .,neutral,neutral,neutral,positive,neutral,neutral
Great New Xenia punya harga yang bersahabat dan interior yang lumayan untuk tipe tertinggi,neutral,neutral,neutral,positive,positive,neutral
brio bagus banget gak bohong !,neutral,neutral,positive,neutral,neutral,neutral
"Semenjak aku mempunyai sebuah unit honda sonic, hidup mungkin terasa bisa leluasa untuk menjangkau ke mana pun ku mau.",neutral,neutral,positive,neutral,neutral,neutral
"Tetapi kalau untuk kaki-kaki , punya saya agak berisik , apalagi lewat jalan rusak , itu kaki-kaki berasa banget bunyi-bunyi nya .",neutral,neutral,neutral,negative,neutral,neutral
"Entah kenapa ya , aku lebih nyaman brio generasi pertama .. Yang kaki kaki nya lebih ceper , good looking di lampu belakang bulat dan kaca semi framless",neutral,neutral,positive,positive,neutral,neutral
"Mungkin sudah 5 tahun saya pakai Kijang innova . Dalam pemakaian sehari-hari yang intens , mobil ini termasuk ramah perawatan .",neutral,neutral,neutral,neutral,neutral,positive
Brio selalu lebih punya karakter kuat tersendiri . Sirion kayak ga punya jati diri,neutral,neutral,negative,neutral,neutral,neutral
"mobil ku xenia tahun 2004 , tipe Li standar . Spion nya masih yang model tipis , kurang elegan .",neutral,neutral,neutral,negative,neutral,neutral
fortuner boros banget bensin nya gak kaya altis yang hemat banget,positive,neutral,neutral,neutral,neutral,neutral
"Mending wuiling almaz . Fitur banyak , mesin turbo , body gede , harga menarik .",neutral,positive,neutral,positive,positive,neutral
nih xexi sering dipakai ke Tasikmalaya lewat Nagrek enggak ada masalah tuh .,neutral,neutral,positive,neutral,neutral,neutral
Pelayanan bengkel Honda AutoBest soekarno hatta jelek banget sih . pantes aja sepi mulu .,neutral,neutral,neutral,neutral,neutral,negative
Kalo dari fitur sih menang sirion . Tapi kalo desain menurut saya brio lebih seksi dan nggak bosenin,neutral,neutral,neutral,positive,neutral,neutral
"keseluruhan gue suka xenia . Murah , desain lucu , muat banyak barang , mudah dibawa , enggak perlu parkiran besar lo . pokok nya Maknyus .",neutral,neutral,positive,positive,positive,neutral
Toyota Calya hemat bahan bakar dan kabin memuat banyak penumpang,positive,neutral,neutral,positive,neutral,neutral
"menyesal gue beli honda vario , jelek banget motor nya .",neutral,neutral,negative,neutral,neutral,neutral
Honda Beat Sporty irit bahan bakar dan model nya bagus sporty dan pilihan warna nya banyak tetapi aku suka warna black hard,positive,neutral,neutral,positive,neutral,neutral
"kalau Xi plus , speed juga enggak ragu buat dites sama mobil kelas lain .",neutral,positive,neutral,neutral,neutral,neutral
cuma pernah komplain saja kalau xenia kopling nya keras sama motor locking door - nya aus,neutral,neutral,neutral,negative,neutral,neutral
Selalu senang setiap berkendara menggunakan Aerox .,neutral,neutral,positive,neutral,neutral,neutral
"Hahaha mas Fitra beruntung datang ke Honda cabang itu , staf ramah & bengkel yang bagus + rapi .",neutral,neutral,neutral,neutral,neutral,positive
"cuma sekarang ini lagi punya pengganjal , kalau melewati polisi tidur Xenia kayak nya dasbor itu bunyi , kayak kurang rigid",neutral,neutral,neutral,negative,neutral,neutral
"Jadi kesimpulan saya buat XPander : "" Enggak banget deh . """,neutral,neutral,negative,neutral,neutral,neutral
Terios baru enak dipakai dan nyaman,neutral,neutral,positive,neutral,neutral,neutral
kualitas Jok Duduk Avanza nyaman karena telah menggunakan bahan tempat duduk berkualitas bagus,neutral,neutral,neutral,positive,neutral,neutral
"Tapi saya bangga punya Karimun Wagon R , mobil ini sangat bisa diandalkan dan ramah di kantong",neutral,neutral,positive,neutral,positive,neutral
Rush baru terlihat lebih gagah dan keren,neutral,neutral,positive,neutral,neutral,neutral
Kaki-kaki HRV terasa berisik pas hajar polisi tidur . Dan itu berefek kretek-kretek ke pintu bagasi . Berisik,neutral,neutral,neutral,negative,neutral,neutral
semenjak saya pakai toyota calya dompet ku enggak lagi bocor alias bbm - nya irit banget . dan enggak sering mengisi bbm lagi .,positive,neutral,neutral,neutral,neutral,neutral
"Toyota innova diesel sangat enak dikendarai , mudah perawatan nya dan sangat irit bbm nya",positive,neutral,positive,neutral,neutral,positive
brio kalo di ajak lari lincah banget tarikan juga halus,neutral,positive,neutral,neutral,neutral,neutral
"Mending Calya lah Irit , suspensi nyaman , muat banyak , inline 4 Silinder dengan VVT - i technology bisa buat taksi daring",positive,neutral,neutral,positive,neutral,neutral
untuk bahan bakar irit pasti avanza,positive,neutral,neutral,neutral,neutral,neutral
"Bagus banget sih Scoopy , cocok buat cewek pas banget . Mesin nya halus juga . ban nya lucu begitu .",neutral,positive,positive,positive,neutral,neutral
benar kata om fitra recall master rem HRV dari dealer antrean nya 3 bulan lebih itu recall,neutral,neutral,neutral,neutral,neutral,negative
saya lebih pilih innova untuk mobil keluarga meskipun harga nya lebih mahal .,neutral,neutral,positive,neutral,negative,neutral
Mobil saya Avanza type G 1300 cc tahun 2007 sampai sekarang mesin nya tidak rewel dan bahan bakar masih irit .,positive,positive,neutral,neutral,neutral,neutral
Suspensi Xpander empuk dan nyaman,neutral,neutral,neutral,positive,neutral,neutral
Mending inilah daripada Honda Jazz city car over price pelit fitur .,neutral,neutral,neutral,negative,negative,neutral
"Desain dasbor HRV kece , seolah-olah semua diorientasikan ke pengemudi",neutral,neutral,neutral,positive,neutral,neutral
"Saya menggunakan avanza tahun 2009 transmisi manual . kualitas mesin top banget . Walaupun dengan pemeliharaan minimal , tetapi hasil nya maksimal .",neutral,positive,neutral,neutral,neutral,neutral
"saya sih mending xi irit sih beda tipis apalagi macet di kota-kota besar enggak berefek xi buat luar kota enak , tanjakan juga oke .",positive,neutral,positive,neutral,neutral,neutral
akhirnya bisa membeli mobil juga . pilihan saya jatuh ke daihatsu xenia sporty . mobil ini sangat nyaman sekali . interior sangat bagus dan elegan . Lari nya juga sangat stabil dan mantap .,neutral,positive,positive,positive,neutral,neutral
xenia li punya saya konsumsi bbm - nya irit banget,positive,neutral,neutral,neutral,neutral,neutral
avanza gaya nya jadul ah gak cocok buat mahasiswa,neutral,neutral,neutral,negative,neutral,neutral
brio bagus banget gak kaya mobil lama saya si calya jelek,neutral,neutral,negative,neutral,neutral,neutral
Tidak ada yang bisa mengalahkan ketangguhan mesin Avanza .,neutral,positive,neutral,neutral,neutral,neutral
Enteng saat dikendarai . Enggak berat . Onderdil mudah dicari . Banyak konter-konter honda di deket rumah . Jadi enggak perlu jauh mencari tempat servis jauh-jauh .,neutral,neutral,positive,positive,neutral,positive
Yamaha Aerox R tarikan oke mesin hebat bodi sporty,neutral,positive,neutral,positive,neutral,neutral
"Pada tahun 2017 saya beli beat , status saya pelajar jadi saya setiap hari pake ke sekolah jujur tarikan nya nyaman dan juga lincah tetapi yang disayangkan ground clearance - nya kurang tinggi",neutral,positive,neutral,negative,neutral,neutral
cat xenia entah kenapa gampang banget baret alus .,neutral,neutral,neutral,negative,neutral,neutral
Xenia li biru dlx AC - nya dingin juga . Mantaplah .,neutral,neutral,neutral,positive,neutral,neutral
"Harga yang mudah terjangkau oleh siapa pun , model Dan teknologi kekinian , perawatan mudah Dan tentunya irit bahan bakar serta purnajual yang bagus , semuanya berkualifikasi bagus . Mantap memang Honda Beat .",positive,neutral,positive,positive,positive,positive
desain dan body interior bagusan fortuner,neutral,neutral,neutral,positive,neutral,neutral
"kalau melihat spesifikasi nya, harga ertiga lumayan overpriced",neutral,neutral,neutral,neutral,negative,neutral
dealer dan bengkel nya HRV di situ pelayanan nya bagus banget plus murah mas .,neutral,neutral,neutral,neutral,neutral,positive
Toyota Calya mobil keluarga lcgc Harga murah yang tidak murahan,neutral,neutral,neutral,neutral,positive,neutral
walaupun secara keseluruha oke tapi kalo bensinnya boros jadi malas beli,negative,neutral,positive,neutral,neutral,neutral
"sudah setahun lebih Toyota Calya ini saya pakai ke tempat-tempat ekstrem , namun sampai saat ini pun belum pernah saya temukan masalah pada mobil ini .",neutral,neutral,positive,neutral,neutral,neutral
"saya percaya , sejauh ini harga jual toyota lebih mahal ketimbang merek yang lain",neutral,neutral,neutral,neutral,positive,neutral
kalo punya toyota ya harus sabar aja kalo servis nya buruk,neutral,neutral,neutral,neutral,neutral,negative
"Honda Vario yang pasti irit bbm , meskipun motor jenis matic tetapi untuk kecepatan tetap tangguh dibandingkan motor dengan cc yang sama dengan transmisi manual",positive,positive,neutral,neutral,neutral,neutral
Wuling Confero mobil yang sangat cocok untuk bepergian jauh,neutral,neutral,positive,neutral,neutral,neutral
Suka banget sama terios baru,neutral,neutral,positive,neutral,neutral,neutral
"Saya juga pakai Honda . Salah satu yang paling saya suka dari merek ini adalah kepraktisan nya ,",neutral,neutral,positive,neutral,neutral,neutral
Saya pertama coba mengendarai honda beat sporty saya suka tarikan nya lincah dan pada saat tanjakan enteng .,neutral,positive,neutral,neutral,neutral,neutral
"calya tidak didesain untuk dipakai di medan yang sulit, lemah!",neutral,neutral,neutral,negative,neutral,neutral
"Kalau buat usaha pakai Li saja , pasti nyaman .",neutral,neutral,positive,neutral,neutral,neutral
altis 2010 saja masih enak apalagi 2014,neutral,neutral,positive,neutral,neutral,neutral
"Honda Vario terasa sangat lincah dan tangguh mengantar saya ke mana saja , membelah tiap lekuk dan sudut yogyakarta dan sekitar nya tanpa khawatir kenapa-kenapa .",neutral,positive,neutral,neutral,neutral,neutral
Honda HRV kaki-kaki terasa ringkih . Per belakang gampang ngejeduk .,neutral,neutral,neutral,negative,neutral,neutral
"Sebener nya alasan saya milih Honda ya karena lebih enak aja tarikan mesin - nya diajak jalan sehari-hari . Lebih cocok dengan selera saya . Jadi minor change atau major change , cuma soal selera",neutral,positive,neutral,neutral,neutral,neutral
"awal nya saya sedikit ragu untuk membeli Wuling Confero L , namun dengan harga yang begitu ramah , memaksa saya memilih kendaraan ini .",neutral,neutral,neutral,neutral,positive,neutral
Kalau aku tetap pilih avanza karena sudah terbukti kehandalan mesin nya.,neutral,negative,neutral,neutral,neutral,neutral
"Xenia Xi sporty kalau pas menghidupkan AC , suara mesin nya berisik banget",neutral,negative,neutral,neutral,neutral,neutral
avanza kenyamanan nya paling juara,neutral,neutral,positive,neutral,neutral,neutral
"punya HRV E 2018 , tenaga nya juga lumayan",neutral,positive,neutral,neutral,neutral,neutral
Karimun Wagon R sesuai kebutuhan & budget aja biar tetep bisa menikmati nya dan tidak menggangu kebutuhan lainnya,neutral,neutral,neutral,neutral,positive,neutral
"Avanza ini bodi nya makin bagus , lebih irit bahan bakar , onderdil banyak dan murah , ukuran lebih lega , mudah dijual , harga jual tinggi , dibawa pulang kampung enak , perawatan murah . Lebih elegan .",positive,neutral,positive,positive,positive,positive
honda brio lebih worth it kalo pengen mobil yang fun to drive,neutral,neutral,positive,neutral,neutral,neutral
"Avanza itu karena bobot nya lebih ringan juragan ,",neutral,neutral,neutral,positive,neutral,neutral
"Yamaha 125 ZR bukan enggak laku , harga nya serasa di awang-awang",neutral,neutral,neutral,neutral,negative,neutral
berarti mesin Xenia terbukti bagus dan bandel + irit BBM,positive,positive,neutral,neutral,neutral,neutral
"Menurut saya veloz gak seindah itu om , gak ada nyaman-nyaman nya kalo dibandingin lawan2 nya .",neutral,neutral,negative,neutral,neutral,neutral
gue punya mobil rentalan 50 biji xenia umur nya sudah 3 tahun semua satu pun kagak ada yang meledak mesin nya .,neutral,positive,neutral,neutral,neutral,neutral
"Iya memang xpander , fasilitas servis nya juga bagus banget",neutral,neutral,neutral,neutral,neutral,positive
salah satu yang saya suka dari yamaha adalah after sales service nya,neutral,neutral,neutral,neutral,neutral,positive
semua produk nissan laku keras di pasaran .,neutral,neutral,positive,neutral,neutral,neutral
"Selama 2 tahun belum ada kendala, Sigra memang mantap.",neutral,neutral,positive,neutral,neutral,neutral
"Ternyata pelayanan bengkel-bengkel yamaha asli jelek banget , gue bagusin stater hand sampe bolak balik cuma kasih duit ke bengkel nya tapi tetep enggak bisa digunain stater gue .",neutral,neutral,neutral,neutral,neutral,negative
