sentence,fuel,machine,others,part,price,service
Aduh jadi nyesel ngambil alya,neutral,neutral,negative,neutral,neutral,neutral
masa saya ke sana waktu hari kerja pekerja nya cuma sedikit bagaimana ini pelayanan dari daihatsu buat pelanggan nya,neutral,neutral,neutral,neutral,neutral,negative
mesin Avanza juga bertenaga juragan .,neutral,positive,neutral,neutral,neutral,neutral
"Altis G 2003 MT , Mesin rasanya powerful banget di rpm 2.500 pun mantap .",neutral,positive,neutral,neutral,neutral,neutral
bangga banget saya punya mobil xenia ini walaupun harga nya mahal .,neutral,neutral,positive,neutral,negative,neutral
pilihan warna brio lucu-lucu semua bingung pilih mana,neutral,neutral,neutral,positive,neutral,neutral
Saya memiliki motor Vespa sprint itu adalah motor yang saya pakai dari SMA saat masa-masa itu motor paling keren bagus dan ganteng deh pokok nya harga nya bersahabat,neutral,neutral,positive,neutral,positive,neutral
cocok banget avanza untuk dibawa liburan bersama keluarga nyaman sekali,neutral,neutral,positive,neutral,neutral,neutral
"enak juga nih xenia 1000 cc , irit dan lincah hehe",positive,positive,positive,neutral,neutral,neutral
"Suspensi toyota calya nyaman , muat banyak , inline 4 Silinder dengan VVT - i technology bisa buat taksi daring",neutral,neutral,neutral,positive,neutral,neutral
"ertiga gaya nya oke banget, tarikan juga mantap dan bandel tapi sayang nya boros banget",negative,positive,neutral,positive,neutral,neutral
"Daihatsu Xenia yang paling pas buat saya dan keluarga , perawatan lebih mudah dan part lebih murah dari kendaraan merek lainnya .",neutral,neutral,positive,positive,neutral,positive
sumpah . gtr ganteng banget asli,neutral,neutral,positive,neutral,neutral,neutral
buat saya untuk ukuran ekonomi menengah ke bawah ya Toyota Calya oke banget harga nya,neutral,neutral,neutral,neutral,positive,neutral
dengan kualitas yang diberikan & harga yang murah menurut saya sangat sangat worth to buy sekali ignis ini,neutral,neutral,positive,neutral,positive,neutral
pakai new avanza bu . Boros bensin haha,negative,neutral,neutral,neutral,neutral,neutral
cooper kecil tetapi mahal,neutral,neutral,neutral,neutral,negative,neutral
tidak pernah bosan saya pakai vario untuk pergi ke kampus .,neutral,neutral,positive,neutral,neutral,neutral
"Harga mahal , tapi fitur gitu gitu aja .",neutral,neutral,neutral,negative,negative,neutral
"yamaha lexi speed nya gila, tarikan nya juara, cuma yah, bensin nya nyedot, bro.",negative,positive,neutral,neutral,neutral,neutral
"Senang gue sama Xenia Li. keluar duit enggak banyak , dapat nya mantap .",neutral,neutral,positive,neutral,positive,neutral
Honda HRV gas nya pelan di jalan enggak rata bunyi semua .,neutral,negative,neutral,neutral,neutral,neutral
"Xenia itu mobil irit oli ( cuma 2 liter ) , irit sparepart ( sparepart - nya cuma dikit ) .",positive,neutral,neutral,positive,neutral,neutral
Interior Mobil Avanza Veloz juga telah dibuatkan Kabin Avanza Veloz dengan tampilan yang lebih Modern dan Elegan,neutral,neutral,neutral,positive,neutral,neutral
Jelas design Mazda cx - 3 lebih cakep diliat dari depan samping dan belakang,neutral,neutral,neutral,positive,neutral,neutral
selama ini tidak pernah bermasalah dan memang mesin nya tangguh dan bandel baik untuk jalan menanjak di pegunungan . Pokok nya Avanza terbaik .,neutral,positive,positive,neutral,neutral,neutral
"desain interior jauh lbh simpel , elegan dan berkelas CX3 dari CHR yg terkesan ribet",neutral,neutral,neutral,negative,neutral,neutral
"Payah , Bengkel honda resmi ga becus ... di sini malah lebih tau .",neutral,neutral,neutral,neutral,negative,neutral
jazz tarikan nya lebih oke daripada brio,neutral,negative,neutral,neutral,neutral,neutral
menurut saya sih dari segi pandangan mata brio itu mewah walaupun minim fitur dan dari gengsi nya juga berbeda,neutral,neutral,positive,negative,neutral,neutral
Kaki-kaki HRV kayak enggak kokoh,neutral,neutral,neutral,negative,neutral,neutral
Ignis ini city car paling terjangkau dengan poin-poin di atas,neutral,neutral,neutral,neutral,positive,neutral
secara keseluruhan avanza bagus kecuali pemakaian bensin yang boros sekali,negative,neutral,positive,neutral,neutral,neutral
"kelemahan nya cuma satu , shock nya keras keras keras keras keras",neutral,neutral,neutral,negative,neutral,neutral
Mau pesaing baru yang buanyak yang keluar dan model sama fitur yg lebih seger . Tetep avanza ini ada di hati,neutral,neutral,positive,neutral,neutral,neutral
"bensin 1:15 luar kota ( sudah irit banget kan ) gesit di tikungan , cuma masih standar .",positive,positive,neutral,neutral,neutral,neutral
Suka sekali xenia perawatan murah pemakaian mudah sparepart oke .,neutral,neutral,positive,positive,neutral,positive
"gede banget nih kapasitas avanza, volume ruangan nya lengang",neutral,neutral,neutral,positive,neutral,neutral
"Saya punya avanza G 2008 , baru juni kemarin saya beli dari Tunas Toyota . terus kopling sudah agak berat saja",neutral,neutral,neutral,negative,neutral,neutral
Saya baru ambil HRV prestige akhir tahun 2017 . Keseluruhan enak dikendarai .,neutral,neutral,positive,neutral,neutral,neutral
"Wah, Wuling formo dari mesin 1200 cc menarik dengan harga yang kompetitif.",neutral,positive,neutral,neutral,negative,neutral
gue juga senang banget soal nya avanza ruang bagasi nya mampu menampung hingga 5 tas berukuran besar dengan susunan rapi ke arah atas . bawa barang banyak pun pasti muat,neutral,neutral,neutral,positive,neutral,neutral
Fitur keamanan ini cukup menaikkan kasta Avanza agar setara dengan low MPV lainnya yang lebih dulu menggunakan air bag keren ya,neutral,neutral,neutral,positive,neutral,neutral
"Masa konsumsi bensin Toyota Avanza Veloz 12,5 liter per kilometer , boros banget anjing",negative,neutral,neutral,neutral,neutral,neutral
kalo gak mau boros jangan beli scoopy,negative,neutral,neutral,neutral,neutral,neutral
"Kalau down shifting terus gaspol itu rasa nya cuma naik rpm saja, tapi power kosong dan memang mesin nya sering ngelitik.",neutral,negative,neutral,neutral,neutral,neutral
saya suka fortuner karena lincah lari nya daripada ertiga yang tenaga nya lemah,neutral,negative,neutral,neutral,neutral,neutral
Mending pajero simple ga kebanyakan desain,neutral,neutral,neutral,positive,neutral,neutral
"Wuling adalah mobil yang bandel di segala medan , irit bahan bakar , desain yang dinamis dan mewah ditambah dengan harga yang pasti nya terjangkau",positive,positive,neutral,positive,positive,neutral
xpander ini mpv paling bagus untuk orang yang cari mobil mpv canggih,neutral,neutral,positive,neutral,neutral,neutral
"Begitu orang melirik Xpander , kesan nya pasti keren desain nya",neutral,neutral,neutral,positive,neutral,neutral
Kok makin jelek aja ya pelayanan di AHAS Terang Anugerah Pamulang,neutral,neutral,neutral,neutral,neutral,negative
"pernah pakai Avanza ke luar kota dari pagi sampai sore , mesin dan AC nyala tanpa henti , tetapi enggak menurun",neutral,positive,neutral,positive,neutral,neutral
kalau mesin dan tampang unggul brio satya . tapi lebih empuk dan lebih murah karimun .,neutral,positive,neutral,positive,positive,neutral
Toyota Avanza Veloz baru adalah menggunakan mesin Dual VVT - i yang sebelumnya menggunakan single VVT - i. juragan mantap,neutral,positive,neutral,neutral,neutral,neutral
"@DaihatsuInd service di bengkel daihatsu harga nya mahal banget , onderdil masih bagus minta diganti sama CS / mekanik nya . Sekali service 2jt",neutral,neutral,neutral,neutral,neutral,negative
mobilio hitam ini cukup membuat orang heran dan memakainya pun terasa gagah,neutral,neutral,positive,neutral,neutral,neutral
brio paling cocok untuk mahasiswa karna style nya yang simpel dan minimalis,neutral,neutral,neutral,positive,neutral,neutral
Saya sopir operasional . Pakai Altis v. Untuk mesin saya akui enak . tarikan mantap handling - nya wow .,neutral,positive,neutral,positive,neutral,neutral
Xenia Xi Sporty secara keseluruhan puas sama ini mobil,neutral,neutral,positive,neutral,neutral,neutral
pilihan jatuh ke Xenia karena faktor harga dan servis Xenia pasti lebih murah hehe .,neutral,neutral,neutral,neutral,positive,positive
vario body nya lebih kokoh daripada mio,neutral,neutral,neutral,negative,neutral,neutral
agya mobil yang bagus dan keren gaya nya,neutral,neutral,positive,positive,neutral,neutral
"masa harus sampe setahun cuma buat inden xpander, kecewa !",neutral,neutral,neutral,neutral,neutral,negative
selama ini pakai xexi lumayan irit,positive,neutral,neutral,neutral,neutral,neutral
"Kenyamanan jauh menang xpander , lebih kedap & bantingan nyaman banget . Harga juga lebih murah",neutral,neutral,positive,neutral,positive,neutral
tampilan desain dasbor interior Avanza terlihat lebih mewah dan stylish,neutral,neutral,neutral,positive,neutral,neutral
Rush performa mesin nya juga enggak kalah dengan SUV lain,neutral,positive,neutral,neutral,neutral,neutral
"Sudah lama pakai Xenia , baru kali dapet yang AC - nya enggak enak dan jok nya kaku .",neutral,neutral,neutral,negative,neutral,neutral
"Udh beli yg 2019 tapi ada 1 kekurangan , jok nya kurang nyaman",neutral,neutral,neutral,negative,neutral,neutral
"Honda beat street adalah sepeda motor yang bisa dikatakan murah , tetapi bukan murahan . Karena selain keren , juga sangat gampang untuk dimodifikasi .",neutral,neutral,positive,neutral,positive,neutral
Jok penumpang mobil Wuling Formo terlihat nyaman,neutral,neutral,neutral,positive,neutral,neutral
"Kok Nissan GL enggak banget , deh .",neutral,neutral,negative,neutral,neutral,neutral
"xenia 1:8 - 9 boros juga ya juragan , karena bodi besar nya dan cc kecil mungkin ya .",negative,neutral,neutral,neutral,neutral,neutral
Ke mana-mana mau jarak dekat atau pun jauh tetap nyaman pakai scooy . muatan bagasi banyak dan mesin tidak cepat panas .,neutral,positive,positive,positive,neutral,neutral
"Saya punya Grand Livina XV tahun 2011 irit nya juara , bang .",positive,neutral,neutral,neutral,neutral,neutral
"enak sih pakai brio , pasaran nya juga stabil",neutral,neutral,positive,neutral,positive,neutral
kenyamanan vario lebih unggul dibanding mio .,neutral,neutral,negative,neutral,neutral,neutral
Li biru dlx harga jual nya pun tinggi . Beli tahun 2004 sekitar 80 jutaan dijual 2009 90 jutaan . Untung juragan .,neutral,neutral,neutral,neutral,positive,neutral
Pajero dong udah Ganteng luar nya Tenaga nya Juga dapet,neutral,positive,neutral,positive,neutral,neutral
"Saya pakai all New Honda Brio Satya E juragan , sangat nyaman dan bagus , apalagi brand - nya H , harga jual nya juga tetap stabil",neutral,neutral,positive,neutral,positive,neutral
xenia bodi nya sudah oke tinggal ganti kaki-kaki saja semoga modifikasi mu menyenangkan,neutral,neutral,neutral,positive,neutral,neutral
menurut ane soal kenyamanan jelas all new pajero sport unggul jauh lebih nyaman dibandingkan all new fortuner yg sangat keras menurut ane,neutral,neutral,negative,neutral,neutral,neutral
akhirnya saya beli avanza karena bandel parah harga nya juga pas di kantong,neutral,positive,neutral,neutral,positive,neutral
"Tetap saja Mobilio masih merupakan Mobil MPV keluarga kelas menengah ke bawah yang paling terbaik dibanding kompetitor nya , bbm paling irit , kabin paling lega sampe baris ke 3 , model paling manis , mesin juga paling kenceng dari kompetitor nya , desain interior juga paling cakep dari kompetitor nya .",positive,positive,positive,positive,neutral,neutral
tak heranlah juragan karena avanza mempunyai fitur yang cukup lengkap dengan harga enggak terlalu mahal,neutral,neutral,neutral,positive,positive,neutral
Saya pakai Xpander karena tidak murahan .,neutral,neutral,positive,neutral,neutral,neutral
after sales service yamaha selalu mengedepankan customer daripada untuk keuntungan sendiri,neutral,neutral,neutral,neutral,neutral,positive
tenaga Fortuner kalah jauh lah . Pajero sport mobil paling tangguh,neutral,positive,neutral,neutral,neutral,neutral
"Si gesit irit motor Honda Beat series tahun 2011 yang selalu setia menemani saya dalam mencari rezeki di kala panas dan hujan , siang dan malam .",positive,positive,neutral,neutral,neutral,neutral
"kalau dari segi desain mah veloz juara nya, avanza terlewat jauh",neutral,neutral,neutral,negative,neutral,neutral
Toyota Calya memang cocok untuk keluarga sangat hemat bbm sangat irit enak dipakai,positive,neutral,positive,neutral,neutral,neutral
ertiga beneran mudah dipakai nya,neutral,neutral,positive,neutral,neutral,neutral
enggak menyesal juga ambil mobil honda enggak kalah bandel irit tahan banting sudah pakai jazz,positive,positive,neutral,positive,neutral,neutral
fortuner sparepart nya gampang ditemukan di mana saja,neutral,neutral,neutral,positive,neutral,neutral
"setelah ngeliat wuling almaz , ngeliat mobilio sama veloz jadi kayak sampah ..",neutral,neutral,negative,neutral,neutral,neutral
"saya sebagai pemakai kijang innova tidak merasa kecewa dan sangat puas , perawatan pun tidak terlalu mahal pokok nya mantap .",neutral,neutral,positive,neutral,neutral,positive
Kalau di suruh milih . jelas milih cx 3 dong,neutral,neutral,positive,neutral,neutral,neutral
"Ternyata service bengkel toyota payah , angin ban bukan nya ditambah malah disemir doang buat apa coba . Jelas-jelas kurang angin gitu",neutral,neutral,neutral,neutral,neutral,negative
Desain velg alloy veloz juga diubah juragan bagi saya desain nya sangat bagus dan terkesan sporty juragan,neutral,neutral,neutral,positive,neutral,neutral
beat cukup ekonomis untuk mahasiswa,neutral,neutral,neutral,neutral,positive,neutral
memang xenia maknyus .,neutral,neutral,positive,neutral,neutral,neutral
gila sih ini xenia bandel nya juara dipakai buat rame-rame juga tetep bandel,neutral,positive,neutral,neutral,neutral,neutral
yang lebih menenangkan dari daihatsu terios adalah hemat bahan bakar .,positive,neutral,neutral,neutral,neutral,neutral
"Fortuner model bapak bapak , Pajero Model Anak muda",neutral,neutral,neutral,positive,neutral,neutral
kalau saya lebih pilih datsun cross . harga lebih murah body lebih kekar,neutral,neutral,neutral,positive,positive,neutral
"CHR design gado2 , berasa liat beberapa mobil dicomot2",neutral,neutral,neutral,negative,neutral,neutral
wah murah nih . modal DP doang . bisa untuk grab car nih . murah meriah masih bisalah untuk jadi grab car .,neutral,neutral,neutral,neutral,positive,neutral
"Karimun wagon saja bang , lebih murah",neutral,neutral,neutral,neutral,positive,neutral
"Honda cuman menang di mesin , kalo fitur dan interior mah parah ... dan mahal , jok nya tipissss bikin tepos kalo jalan lama",neutral,positive,neutral,negative,negative,neutral
Avanza enak dipakai . sangat cocok buat mobil keluarga . harga nya tidak terlalu mahal buat mobil dengan spesifikasi yang lumayan .,neutral,neutral,positive,neutral,positive,neutral
Avanza Veloz 1.5 type 1.5 G nya aja nggak laku banget dan nggak pernah nampak di jalan,neutral,neutral,negative,neutral,neutral,neutral
"Duh ni bengkel mitsubishi , jelek kali sih . Kayak kandang saja bengkel nya .",neutral,neutral,neutral,neutral,neutral,negative
Bengkel @Hondaarista Jatinegara not recommended . Payah . Sudah booking servis tapi disuruh mengantri .,neutral,neutral,neutral,neutral,neutral,negative
konsumsi bahan bakar yang cukup irit menurut saya adalah poin penting dari Calya ini .,positive,neutral,neutral,neutral,neutral,neutral
Avanza sangat mendukung profesi yang saya jalani karena bbm - nya irit .,positive,neutral,neutral,neutral,neutral,neutral
Ini ruang tunggu bengkel @ToyotaID paling nyaman . Hampir 3 jam dan masih betah . Pelayanan ramah . Enak nya punya Toyota .,neutral,neutral,neutral,neutral,neutral,positive
Xenia 1.300 cc mesin nya lincah dan bisa beramai-ramai hehe .,neutral,positive,positive,neutral,neutral,neutral
"nambah logo doang , harga naik puluhan juta",neutral,neutral,neutral,neutral,negative,neutral
Avanza juga tentunya nyaman dikendarai .,neutral,neutral,positive,neutral,neutral,neutral
"Mobil ini terlalu over price bos , untung menang merek",neutral,neutral,neutral,neutral,negative,neutral
Suzuki Karimun GX tidak hanya bandel dan memiliki kabin luas tetapi juga irit,positive,positive,neutral,positive,neutral,neutral
All - new Brio dengan harga termurah 135 - an juta tidak layak .,neutral,neutral,neutral,neutral,negative,neutral
Setelah melihat ini ku yakin akan beli Honda CR - V,neutral,neutral,positive,neutral,neutral,neutral
Grand Livina XV AT 2008 ngelitik nya parah kak sekarang juga lumayan boros,negative,negative,neutral,neutral,neutral,neutral
gua lebih pilih Fortuner karna tampilan nya gagah tidak seperti pajero,neutral,neutral,negative,neutral,neutral,neutral
Pergi kerja setiap hari lebih enak pakai Honda Vultus.,neutral,neutral,positive,neutral,neutral,neutral
Driver lebih nyaman dengan posisi perseneling yang unik. Terima kasih Sigra.,neutral,neutral,neutral,positive,neutral,neutral
"Menurut saya untuk service , HONDA lebih bagus dari NISSAN .",neutral,neutral,neutral,neutral,neutral,negative
"Mobil yang sangat cocok dan sangat nyaman digunakan saat bersama keluarga , suara mesin yang halus , eksterior yang nyaman dipandang , interior nya juga menarik , selain itu hemat bahan bakar .",positive,positive,positive,positive,neutral,neutral
Tidak salah pilih avanza . Sudah 10 tahun mobil avanza saya masih bisa melaju kencang secara optimal .,neutral,positive,neutral,neutral,neutral,neutral
"Avanza teman terbaik untuk di segala medan jalanan , plus harga nya masih terjangkau .",neutral,neutral,positive,neutral,positive,neutral
Mesin bandel dan irit menjadi alasan banyak keluarga di Indonesia memilih Agya sebagai mobil pertama mereka,positive,positive,neutral,neutral,neutral,neutral
Jakarta - Bandung pakai xenia cuma 1 setengah jam . sungguh mesin yang sangat tangguh .,neutral,positive,neutral,neutral,neutral,neutral
saya sih secara pribadi puas banget sama Xeli . nyaman .,neutral,neutral,positive,neutral,neutral,neutral
"gue pernah pakai karimun sebelum mobil gue yang sekarang , menurut gue ini lcgc paling nyaman , paling murah",neutral,neutral,positive,neutral,positive,neutral
Kelemahan Daihatsu sigra adalah bodinya ringkih dan kurang kedap suara luar.,neutral,neutral,neutral,negative,neutral,neutral
"Toyota Avanza , Low MPV dengan Jaringan Penjualan dan Purnajual Terbanyak",neutral,neutral,positive,neutral,positive,neutral
Xenia yang 1000 cc punya handling yang lebih lincah dan enteng,neutral,neutral,neutral,positive,neutral,neutral
Vario bentuk nya seksi buat boncengan pun nyaman dan aman sistem semua sudah canggih dan bbm irit di dompet kita semua .,positive,neutral,neutral,positive,neutral,neutral
"Awal nya saya membeli motor pada tahun 2016 , alhamdulillah sampai sekarang motor saya masih irit dan tangguh di jalan",positive,positive,neutral,neutral,neutral,neutral
kalo dibandingkan dari segi service nya nissan jauh lebih unggul daripada toyota yang asal-asalan,neutral,neutral,neutral,neutral,neutral,negative
kata orang yang XI malah lebih irit dari yang LI nih .,negative,neutral,neutral,neutral,neutral,neutral
coba saja dibandingkan buat lari pasti brio lebih lincah daripada calya,neutral,negative,neutral,neutral,neutral,neutral
"Untuk saya sendiri yang sudah memiliki TERIOS X DELUXE MT , saya cukup puas apa yang sudah saya miliki terima kasih daihatsu",neutral,neutral,positive,neutral,neutral,neutral
MOBIL ku xenia 1.300 cc irit dipakai nya,positive,neutral,neutral,neutral,neutral,neutral
Toyota rush gagah dan tangguh di medan yang terjal sekalipun dan nyaman di jalan yang mulus .,neutral,neutral,positive,neutral,neutral,neutral
mobilio tarikan halus banget menang telak daripada agya kalah jauh,neutral,negative,neutral,neutral,neutral,neutral
scoopy keren banget body nya juga unik dan cocok buat anak muda penuh gaya,neutral,neutral,positive,positive,neutral,neutral
avanza 1.3 L memang irit kalau dibawa 60 - 80 km / jam .,positive,neutral,neutral,neutral,neutral,neutral
Kenapa sekelas Fortuner belum ada sunroof nya ya,neutral,neutral,neutral,negative,neutral,neutral
Harga nya 4x4 nya fortuner lebih worth it di Banding Pajero sport,neutral,neutral,neutral,neutral,negative,neutral
kalau brio senyaman ini gak papa mau macet lama juga tetap betah di dalam,neutral,neutral,positive,neutral,neutral,neutral
"Menurut saya aja nih , muka enakan sirion , untuk pantat enak brio",neutral,neutral,neutral,positive,neutral,neutral
pengalaman kemarin sewa rental di Bali kopling nya agak tinggi jadi pas tanjakan agak menahan-nahan begitu kurang gesit padahal Karimun,neutral,neutral,neutral,negative,neutral,neutral
"Motor Honda beat matic yang satu ini menurut ku memang cocok buat semua kalangan , dari segi harga yang murah tetapi tidak membuat produk ini asal-asalan .",neutral,neutral,positive,neutral,positive,neutral
tampilan Avanza bergaya khas crossover ini memiliki kesan sporty dan agresif,neutral,neutral,neutral,positive,neutral,neutral
yaudah gue enggak ragu ambil Calya ini buat harian,neutral,neutral,positive,neutral,neutral,neutral
Soal nya menurut saya Wuling Confero S 1.5 tipe tertinggi harga nya lebih murah hanya 160 jutaan,neutral,neutral,neutral,neutral,positive,neutral
dengan harga nya terjangkau mobil avanza ini masih digemari masyarakat indonesia sebagai mobil keluarga pilihan,neutral,neutral,neutral,neutral,positive,neutral
Sayang enggak ada gps map - nya kayak versi yang lama . Padahal lumayan buat ke kondangan di pelosok yang susah sinyal . Screen mirror juga masa pakai kabel saja bisa nya,neutral,neutral,neutral,negative,neutral,neutral
Untuk menjaga performa terbaik Innova ini tak perlu banyak biaya servis seperti mobil saya terdahulu .,neutral,neutral,neutral,neutral,neutral,positive
Kabin depan tengah dan belakang lebih lega dan nyaman PAJERO SPORT dibanding FORTUNER,neutral,neutral,neutral,negative,neutral,neutral
"Bapak gue punya gl yang facelift 2013 , sampai sini masih bagus , mesin masih enak + bensin V - power , belum pernah turun mesin",neutral,positive,positive,neutral,neutral,neutral
Terakhir service ke bengkel Daihatsu tahun 2016 . Agak mahal sih memang . Ehe .,neutral,neutral,neutral,neutral,neutral,negative
Keseluruhan puas banget sih pakai hrv,neutral,neutral,positive,neutral,neutral,neutral
mesin nya Avanza bandel dan nyaman dipakai .,neutral,positive,positive,neutral,neutral,neutral
"mobil avanza tidak terlau mahal , tetapi banyak fitur yang mendukung .",neutral,neutral,neutral,positive,positive,neutral
"kalau ertiga body oke lah minimalis gitu, tapi tarikan lambat banget",neutral,negative,neutral,positive,neutral,neutral
saya dukung mobil fortuner,neutral,neutral,positive,neutral,neutral,neutral
"Honda Beat sangat mengerti di saat kantong lagi tipis tidak pernah rewel , mesin masih halus terus meskipun tiap hari dibawa perjalanan jauh terus",neutral,positive,positive,neutral,neutral,neutral
Calya lari nya juga lumayan kencang mantap jiwa,neutral,positive,neutral,neutral,neutral,neutral
sayang nya veloz masih menggunakan lampu halogen bukan LED ya juragan,neutral,neutral,neutral,negative,neutral,neutral
HRV ini punya ultra seat jadi bawa barang yang jangkung atau mau menyembunyikan barang bisa di bawah jok . keren sih .,neutral,neutral,neutral,positive,neutral,neutral
honda brio termasuk yang cukup ekonomis di kelas nya,neutral,neutral,neutral,neutral,positive,neutral
Secara service untuk konsumen daihatsu masih lebih bagus dibanding toyota.,neutral,neutral,neutral,neutral,neutral,negative
cukup sebulan buat inden fortuner gak kaya xpander sampe setahun,neutral,neutral,neutral,neutral,neutral,negative
scoopy kaya nya memang dibuat untuk anak muda yang oke pokoknya,neutral,neutral,positive,neutral,neutral,neutral
"Suka deh sama pilihan mobil avanza yang satu ini , tenaga bagus dan bandel",neutral,positive,neutral,neutral,neutral,neutral
"4 tahun pakai altis , terbukti sih ini mobil mesin nya bandel banget",neutral,positive,neutral,neutral,neutral,neutral
Ini gue saja yang merasa bensin Xenia boros banget apa memang iya sih,negative,neutral,neutral,neutral,neutral,neutral
Pajero sport lah ! Fitur safety nya lebih cakep daripada Fortuner,neutral,neutral,neutral,negative,neutral,neutral
"Njrit , mahal amat , vario perawatan cuma perlu ganti oli mesin sama gardan , kalau ada yang perlu diganti ya gue ganti sendiri , gue mending modal dikit beli toolkits buat bongkar motor daripada dibawa ke bengkel resmi , suka ngaco bengkel resmi",neutral,neutral,neutral,neutral,neutral,negative
"CHR = harga selangit , fitur kurang joss",neutral,neutral,neutral,negative,negative,neutral
Bengkel honda payah bro ! Ngaret . Bengkel sebelah on time . #noted,neutral,neutral,neutral,neutral,neutral,negative
keren pajero bro ... fortuner mah lewat ..,neutral,neutral,negative,neutral,neutral,neutral
Yahama Aerox 155 vva akselerasi memang top.,neutral,positive,neutral,neutral,neutral,neutral
scoopy kece . Bensin irit dibawa jauh pun tidak rewel . Enggak banyak buang-buang uang saat servis .,positive,neutral,positive,neutral,neutral,positive
"Daihatsu Sigra, tangki bensin rawan bocor karena terbuat dari bahan plastik.",neutral,neutral,neutral,negative,neutral,neutral
"menurut gue ini mobil agak cengeng sih , alias banyak penyakit , menurut pendapat saya",neutral,neutral,negative,neutral,neutral,neutral
"grand livina XV matic saya sangat nyaman , enggak pernah ada masalah berarti . nissan top",neutral,neutral,positive,neutral,neutral,neutral
Altis ku tahun 2001 istimewa banget,neutral,neutral,positive,neutral,neutral,neutral
Desain Unibody ini memberikan kemampuan lebih kepada Avanza dalam menahan beban dan itu salah satu poin dibandingkan dengan para pesaing nya juragan,neutral,neutral,neutral,positive,neutral,neutral
Entah kenapa gue melihat mobil ini enggak proporsional dari samping - belakang,neutral,neutral,neutral,negative,neutral,neutral
Menurut gw sih fortuner menang jauh dari segi kemewahan nya daripada pajero yg kampungan banget,neutral,neutral,negative,neutral,neutral,neutral
